Date,ISOWeek,DOI,Version,Category,Title,Authors,Abstract
2026-05-17,20,10.64898/2026.05.12.26350999,1,"infectious diseases","Detecting simulated pathogen releases in a real-world health data set","Moss, R.; Testolin, M. J.; Pitsaris, C.; Hill, A. M.; Muscatello, D. J.; McCaw, J. M.; Dawson, P.","The purpose of electronic disease syndromic surveillance (EDSyS) systems is to detect hazardous pathogens and other unusual signals in health surveillance data before such events are identified by an individual clinician or healthcare facility. However, EDSyS systems have primarily been evaluated using simulated health surveillance data, which do not necessarily capture the richness and complexities of real-world health data. We have updated and extended an existing EDSyS system, EpiDefend, which combines ensemble forecasting and recursive Bayesian estimation in a particle filter framework that supports demographic and spatial structure. We simulated the release of several pathogens, both infectious and non-infectious, and injected the resulting cases into a real-world health data set. Here we evaluate EpiDefends sensitivity and specificity in detecting these simulated releases, and measure the time to detection against pathogen-specific estimates of the time to clinical detection, as informed by clinicians and microbiologists. We show that for diseases where clinical diagnosis can be challenging, such as Q fever (Coxiella burnetii) and tularaemia (Francisella tularensis), EpiDefend can reliably beat the time to clinical detection. In contrast, for pathogens that can be clinically diagnosed relatively quickly, such as inhalational anthrax and pneumonic plague, it is extremely difficult to beat the time to clinical detection. Our results suggest that EpiDefend may be able to reliably detect real-world introductions or releases of some pathogens at low false-alarm rates before a clinical diagnosis would be confirmed, and this would represent a landmark achievement for EDSyS systems."
2026-05-17,20,10.64898/2026.05.12.26352742,2,"allergy and immunology","Determinants of total and inhaled allergen-specific immunoglobulin E in the middle-aged and elderly population","Al Fatly, M.; Leonard, S.; van Daele, P.; Helleman, G.; Tobari-Azandeh, E.; Lahousse, L.; Veenbergen, S.; Chaker, L.","BackgroundThe determinants of immunoglobulin E (IgE) remain poorly understood in older adults, a population with an increasing burden of chronic diseases. Identifying IgEs determinants may improve its clinical interpretation in the evaluation of allergic and IgE-related conditions.

ObjectiveTo investigate age, sex, smoking, alcohol, body mass index (BMI), corticosteroid use, and season as potential determinants of total IgE (tIgE) and inhaled allergen-specific IgE (sIgE).

MethodsUsing Rotterdam Study data, we investigated the determinants of tIgE and sIgE using multivariable linear regression. Longitudinal changes and the effects of corticosteroids were assessed with linear mixed models.

ResultsWe included 8769 participants, of which 478 had repeated IgE measurements. Age showed a U-shaped relationship with tIgE and L-shaped relationship with sIgE (both p<0.001). Women had lower tIgE (OR [95%CI]: 0.69 [0.65-0.74]), whereas current smokers (1.34 [1.23-1.46]), higher BMI (1.01 [1.01-1.02]), topical corticosteroid users (1.27 [1.07-1.50]) and inhaled corticosteroid users (1.93 [1.64-2.26]) showed higher tIgE. Women (0.96 [0.92-1.00]), former smokers (0.87 [0.83-0.91]) and current smokers (0.72 [0.68-0.76]) had lower sIgE, whereas topical corticosteroid users (1.20 [1.07-1.35]) and inhaled corticosteroid users (1.20 [1.07-1.35]) showed higher sIgE. Over time, tIgE and sIgE decreased (p<0.001) but did not significantly change after corticosteroid use.

ConclusionWe identified age, sex, smoking, BMI, season and topical and inhaled corticosteroids as determinants of tIgE and sIgE. Incorporating these determinants may improve IgEs clinical interpretation for the diagnosis and management of allergic and IgE-related conditions. Future research should investigate how these determinants shape IgEs relationship with chronic diseases in aging populations."
2026-05-17,20,10.64898/2026.05.13.26353146,1,epidemiology,"Association Between Purchase of Organic Food and Hypertension Among US Adults: NHANES 2007-2010","Choi, C.; Nianogo, R. A.; Chen, L.; Arah, O. A.","BackgroundAn increasing demand for organic food has risen due to perceived health benefits. Current evidence for the health effects of organic food is limited.

ObjectiveTo evaluate the association between organic food purchase as a proxy for organic food consumption and hypertension in a nationally representative population of the US.

MethodsThis was a cross-sectional study that included 9173 participants aged [&ge;] 18 and had available data of both organic food purchase and hypertension from the National Health and Nutrition Examination Survey 2007-2010. Organic food purchase and frequency were obtained from survey questionnaires. Hypertension was defined as having either a systolic BP [&ge;] 130 mm Hg/ diastolic BP [&ge;] 80 mm Hg, currently taking antihypertensive medication, or self-reported diagnosis of hypertension. We used multivariable logistic regression with sample weights and adjustment of potential confounders to assess associations (adjusted odds ratio [aOR] and 95% confidence intervals [CI]) between organic food purchase and hypertension status.

ResultsFindings suggest an 11% decrease in odds of hypertension (aOR = 0.89, 95% CI: 0.75- 1.06) among organic food purchasers compared to non-purchasers. Lower odds of hypertension were observed across all categories of organic food purchasing frequency, with 13% lower among rarely purchasing organic food (aOR = 0.87, 95% CI: 0.67-1.14), 9% lower (aOR = 0.91, 95% CI: 0.71-1.16) among sometimes purchasing organic food, and 17% lower (aOR = 0.83, 95% CI: 0.55-1.27) among always or mostly purchasing organic food, as compared to those who never purchased organic food.

ConclusionOur findings suggest that organic food purchase, a proxy for organic food consumption, may be associated with lower odds of hypertension. These findings may reflect either the true benefits of organic food consumption, including lower pesticide amounts and higher nutrient content, or the health-seeking behaviors among health-conscious, healthy, and highly educated individuals."
2026-05-17,20,10.64898/2026.05.12.26353074,1,epidemiology,"Geographic Clustering and Spatial Spillovers of Pediatric Appendicitis Mortality: A 169-Country Spatial Analysis from 2000 to 2019","yang, z.; Wu, P.; Fu, Y.; Jiang, B.; Huang, L.; Zhou, J.","BackgroundAppendicitis is a readily treatable surgical emergency, yet it remains a cause of preventable death among children in resource-limited settings. While recent studies have documented the global burden of pediatric appendicitis, none have systematically examined its geographic clustering or spatial spillover effects. Understanding whether high-mortality countries cluster geographically, and whether neighboring countries influence each others outcomes, is essential for designing regional surgical capacity strategies.

MethodsWe conducted a spatial analysis of pediatric appendicitis case fatality rates in children aged 0-14 years across 169 countries from 2000 to 2019. Data were obtained from the Global Burden of Disease Study 2023 and World Bank databases. We calculated global Morans I to assess spatial autocorrelation, used Getis-Ord Gi* to identify local hotspots, and fitted spatial lag and spatial error regression models to quantify spatial spillovers while adjusting for GDP per capita, physician density, and basic sanitation access.

ResultsGlobal Morans I was 0.621 in 2000 (p < 0.001), 0.621 in 2010 (p < 0.001), and 0.592 in 2019 (p < 0.001), indicating strong and persistent spatial clustering. Hotspots at 99% confidence were consistently concentrated in sub-Saharan Africa and parts of South Asia, with little change in geographic distribution over two decades. The spatial error model provided the best fit (AIC = 212.6), with a spatial error coefficient ({lambda}) of 0.663 (p < 0.001), suggesting that approximately 66% of residual variation was explained by unobserved regional factors. In the final model, higher GDP per capita ({beta} = -0.497, p < 0.001) and higher physician density ({beta} = -0.568, p < 0.001) were independently associated with lower case fatality, while basic sanitation access showed no significant association (p = 0.284).

ConclusionsPediatric appendicitis case fatality exhibits strong and persistent geographic clustering. The substantial spatial spillover effect suggests that regional coordination of surgical capacity building may be more effective than country-by-country investments. Priority should be given to hotspot countries in sub-Saharan Africa and South Asia, with emphasis on surgical workforce expansion rather than broad economic development alone."
2026-05-17,20,10.1101/2025.08.05.25333011,3,epidemiology,"Baseline characteristics of the population-based cohort in Iga City - the Iga City Cohort Study","Hishida, A.; Shirai, Y.; Kageyama, I.; Kawai, S.; Sasakabe, T.; Lin, Y.; Yamamoto, M.; Nishio, M.; Okuda, H.; Tanaka, K.; Miyata, K.; Tamura, T.; Nagayoshi, M.; Matsunaga, T.; Hamajima, N.; Wakai, K.","We conducted a population-based genome cohort in Iga City, named Iga City Cohort Study, from March 2013 until June 2014, and recruited 1,578 participants in alliance with the J-MICC (Japan Multi-Institutional Collaborative Cohort) Study, under the cooperation of Iga citizens and the support of medical staffs in Iga City General Hospital with the aim of establishing the evidence for personalized disease prevention based on genomic information of each individual. After obtaining informed consent, interviews were conducted using the questionnaire constructed based on those practically used in J-MICC Study, where information on smoking behaviors, drinking habits, physical activities, food intake (food frequency questionnaire, FFQ) and socioeconomic status (SES) including educational backgrounds was asked and collected. Biological samples were collected together with the health check-up examination samples. The samples collected included serum, plasma and buffy coat from which genomic DNA was extracted after centrifuge procedures. In parallel, we performed a public service for Helicobacter pylori (HP) eradication to Iga citizens, and research on the minimally invasive diagnostic testing for early detection of cancer is now ongoing. After exclusion of ineligible participants and participants who withdrew, 1,505 subjects remain under follow-up. Effective utilization of the collected data in this cohort study for the health promotion of Iga citizens as well as Japanese citizens is greatly expected."
2026-05-17,20,10.64898/2026.05.15.26352743,1,"public and global health","Reconstruction of immunisation during conflict: A mixed-methods cohort evaluation of programme delivery and outcomes in Myanmar","Fishbein, D. B.; Thura-Aung, H.; Ong, R.; Nyein, A.; Kyaw, Z. L.; Karenni, E.; Jie, J.; Maw, K.; Khant, K.; Poe, A.; Win, M.; Grissom, B.; TinOo, C.","IntroductionRoutine childhood immunisation is frequently disrupted in conflict-affected settings, leaving many children unvaccinated (zero-dose [ZD]). Their vaccination is now a global priority, but published evidence on restoring immunisation services in these settings is limited. We evaluated a nurse-led, community-based Expanded Programme on Immunisation adapted to a conflict-affected setting in Myanmar, focusing on factors associated with full immunisation (FI) among ZD children.

MethodsThis mixed-methods observational cohort study enrolled children from November 2023 to December 2025; analyses of FI outcomes were restricted to children enrolled [&ge;]18 months, with primary analyses focused on ZD children. Associations between programme delivery factors--including vaccination opportunity (the ratio of vaccination sessions available to visits required for FI based on age and vaccination schedule [accelerated versus routine])--and FI were assessed using mixed-effects logistic regression with a random intercept for site. Programme cost and qualitative data from document review and questionnaires were also analysed.

ResultsOf 13,263 children enrolled, 6563 (49%) were in the analytic cohort; 2,684 (20%) were ZD. Among ZD, 452 (17%) were FI at 12 months and 1329 (50%) at 18 months. Accelerated schedule (OR 3.00, 95% CI 1.11-8.13) and greater vaccination opportunity (OR 2.1 per 0.5 unit increase in opportunity, 95% CI 1.8-2.4) were strongly associated with FI at 12 months, with smaller effects at 18 months. The cost per fully immunised ZD child was US$147, primarily reflecting substantial vaccine costs. Qualitative findings indicate that community engagement increased demand and access, but insecurity and logistical challenges limited service continuity and vaccination opportunities.

ConclusionFI improved over time but remained suboptimal through 18 months. Vaccination opportunity and schedule influenced the timing of FI, but sustained follow-up was critical for completion. Community-based delivery enabled restoration of immunisation services where formal systems had collapsed, demonstrating what is possible--and what it demands--in active conflict.

FundingUnited Nations

KEY MESSAGESO_ST_ABSWHAT IS ALREADY KNOWN ON THIS TOPICC_ST_ABSReaching zero-dose (ZD) children in fragile and conflict-affected settings is a priority of the WHO Immunization Agenda 2030, but published evidence on programmes attempting to restore immunisation in such settings is limited.

Routine immunisation services in Myanmar collapsed following the 2021 military coup and subsequent access restrictions amounted to a de facto humanitarian blockade.

WHAT THIS STUDY ADDSThis study provides among the first longitudinal evidence on implementation, costs, and outcomes of community-based immunisation among ZD children during active conflict.

Half of ZD children and 78% of those who were incompletely immunised at enrolment achieved full immunisation within 18 months.

Programme factors including accelerated vaccination schedule and increased vaccination opportunities were associated with earlier completion; sustained retention was the dominant determinant of overall coverage.

HOW THIS STUDY MIGHT AFFECT RESEARCH, PRACTICE OR POLICYCommunity-based delivery through civil society organisations can restore immunisation services in high priority settings but its fragility and need for sustained external support cannot be ignored.

Expanding vaccination opportunities, using accelerated schedules, and actively retaining children after enrolment are actionable steps to increase coverage."
2026-05-17,20,10.64898/2026.05.13.26353093,1,epidemiology,"Potential limitations of community-wide strategy to treat Mycobacterium tuberculosis infection","Batabyal, S.; Urdahl, K.; Ganusov, V. V.","A quarter of the worlds population has immunologic evidence of past or present Mycobacterium tuberculosis (Mtb) infection (MTBI) detected as TST or IGRA positivity. Community-based preventive treatment of individuals with MTBI has resulted in transient decreases in TB cases, but its long-term effectiveness has been controversial. Due to the likelihood that many of those with immune responses to Mtb antigens may no longer harbor Mtb, widespread treatment of all such individuals may result in unnecessary exposure to antibiotics. We raise an additional concern that preventive treatment of individuals with MTBI, who are not at the risk of disease progression, may result in loss of protective immunity, provided by the persistent infection, and enhanced risk of TB upon re-exposure to Mtb. There is evidence from human cohorts and animal studies that prior exposure to Mtb confers protection against TB development upon re-exposure, and that treatment of Mtb-infected animals often results in loss of this protection. We build a novel epidemiological model of Mtb dynamics and progression to TB in a community allowing for protection afforded by MTBI against exogenous reinfection-driven disease progression. We show that implementation of treatment of MTBI in the whole community will result in reduction of TB cases but stopping the program may result in an increase in new TB cases that may offset (or even exceed) benefits of the preventive treatment program. Our results suggest that better understanding protective effects provided by MTBI against progression to TB upon Mtb re-exposure and identification of Mtb-infected individuals who most benefit from preventive treatment must be a priority before preventive treatment of asymptomatic MTBI is widely implemented."
2026-05-17,20,10.64898/2026.05.15.26347859,1,epidemiology,"Who infected the reported cases? Evidence from 678,482 COVID-19 cases with identified infector collected in routine surveillance in the Netherlands, 2020-2022.","Backer, J. A.; Leung, K. Y.; Andeweg, S. P.; Van de Kassteele, J.; Veldhuijzen, I.; Hahne, S.; Wallinga, J.","BackgroundDuring infectious disease outbreaks, characteristics of reported cases are routinely collected. These give information on becoming infected but not on infecting others. We assess whether linking infectees to infectors, together with their characteristics, can help understand transmission.

MethodsFrom the start of the COVID-19 pandemic in the Netherlands, reported cases were asked to identify their most probable infector in routine surveillance, enabling the linking of cases. We assess for the period 27 February 2020 - 11 April 2022 whether the infectees of these transmission pairs are representative of all reported cases, whether the transmission pairs yield verifiable estimates of epidemiological characteristics (here the serial interval), and whether they provide information on transmission that cannot be obtained otherwise.

ResultsOf 8,003,008 reported cases, 678,482 (8.5%) could be linked to their most probable infector. These infectees were largely representative of the reported cases regarding age group, sex, and geographical location. The mean serial interval of 3.6 days (sd 3.4 days) from transmission pairs aligns with literature. Transmissions between age groups largely follow known contact patterns. Most transmissions in September 2021 occurred between persons who were not (fully) vaccinated, indicating the effectiveness of the vaccine, and relatively few between persons with different vaccination status, indicating assortative mixing in vaccination status.

ConclusionTransmission pairs can be efficiently collected in routine surveillance, providing insight into disease transmission. The current post-pandemic period provides an excellent opportunity to adjust reporting systems for linking infectees to their most probable infector as preparation for future outbreaks."
2026-05-17,20,10.64898/2026.05.12.26353060,1,"public and global health","Community awareness, access, and experiences of cervical screening following universal access to self-collection in Australia","Jennett, C. J.; Bavor, C.; Saunders, T.; Whop, L. J.; Mitchell, L. E.; Canfell, K.; Taylor, N.; Velentzis, L.; Egger, S.; Brotherton, J. M.; Nightingale, C.; Smith, M. A.","BackgroundSince July 2022, Australian National Cervical Screening Guidelines have recommended anyone eligible for cervical screening be offered the choice between having their sample collected by a clinician with a speculum, or self-collection using a vaginal swab.

MethodWe recruited screen-eligible people to an online survey between December 2023 and April 2024, via a paid social media (Meta) campaign, and stakeholder and community networks.

Using binary logistic regression, we assessed demographic and screening history factors associated with having previously heard of self-collection. In participants screened since July-2022, we assessed factors associated with being offered a choice between self-collection and clinician-collection; choosing self-collection (among those offered choice); and using self-collection (among all recently screened participants).

ResultsOf the 9,928 participants, 70.2% had heard of self-collection. Among those screened since July 2022, 36.1% were offered a choice in screening method.

Awareness was associated with increasing age (p-trend <0.001), with participants aged >65 years most likely to have heard of self-collection (adjusted odds ratio (aOR): 1.69, 95% confidence interval (95%CI): 1.31-2.18).

Compared to participants who self-reported regularly attending cervical screening, both not-regular and never screeners (based on self-reported screening history, frequency, age and sexual history) were less likely to have heard of self-collection (aOR:0.80 [95%CI:0.72-0.89] and aOR:0.73 [95%CI:0.56-0.96], respectively; p<0.001). Participants who attended a specialised womens/sexual health clinic were more likely to have heard of self-collection (aOR:1.32 (95%CI:1.06-1.64), p;<0.001), and to report being offered choice (aOR:1.62 (95%CI 1.22-2.14), p<0.001) at their last cervical screen.

Half of the participants who were offered a choice opted for self-collection (N=803/1,617; 49.7%). Not-regular screeners were twice as likely (aOR:2.31 (95%CI:1.74-3.07), p<0.001) to choose self-collection as regular-screeners.

ConclusionGiven almost 50% of women nationally are now choosing self-collection, these findings imply national uptake might be close to plateauing overall. In high income settings where a choice in screening methods is introduced with the aim of improving screening equity, resources, adequate training, and health promotion tools should be provided prior to program launch to support healthcare providers in offering choice and facilitate improved participation in screening programs. Raising community awareness of screening options is important and needs to reach under-screened groups."
