Date,ISOWeek,DOI,Version,Category,Title,Authors
2026-05-17,20,10.64898/2026.05.12.26350999,1,infectious diseases,Detecting simulated pathogen releases in a real-world health data set,"Moss, R.; Testolin, M. J.; Pitsaris, C.; Hill, A. M.; Muscatello, D. J.; McCaw, J. M.; Dawson, P."
2026-05-17,20,10.64898/2026.05.12.26352742,2,allergy and immunology,Determinants of total and inhaled allergen-specific immunoglobulin E in the middle-aged and elderly population,"Al Fatly, M.; Leonard, S.; van Daele, P.; Helleman, G.; Tobari-Azandeh, E.; Lahousse, L.; Veenbergen, S.; Chaker, L."
2026-05-17,20,10.64898/2026.05.13.26353146,1,epidemiology,Association Between Purchase of Organic Food and Hypertension Among US Adults: NHANES 2007-2010,"Choi, C.; Nianogo, R. A.; Chen, L.; Arah, O. A."
2026-05-17,20,10.64898/2026.05.12.26353074,1,epidemiology,Geographic Clustering and Spatial Spillovers of Pediatric Appendicitis Mortality: A 169-Country Spatial Analysis from 2000 to 2019,"yang, z.; Wu, P.; Fu, Y.; Jiang, B.; Huang, L.; Zhou, J."
2026-05-17,20,10.1101/2025.08.05.25333011,3,epidemiology,Baseline characteristics of the population-based cohort in Iga City - the Iga City Cohort Study,"Hishida, A.; Shirai, Y.; Kageyama, I.; Kawai, S.; Sasakabe, T.; Lin, Y.; Yamamoto, M.; Nishio, M.; Okuda, H.; Tanaka, K.; Miyata, K.; Tamura, T.; Nagayoshi, M.; Matsunaga, T.; Hamajima, N.; Wakai, K."
2026-05-17,20,10.64898/2026.05.15.26352743,1,public and global health,Reconstruction of immunisation during conflict: A mixed-methods cohort evaluation of programme delivery and outcomes in Myanmar,"Fishbein, D. B.; Thura-Aung, H.; Ong, R.; Nyein, A.; Kyaw, Z. L.; Karenni, E.; Jie, J.; Maw, K.; Khant, K.; Poe, A.; Win, M.; Grissom, B.; TinOo, C."
2026-05-17,20,10.64898/2026.05.13.26353093,1,epidemiology,Potential limitations of community-wide strategy to treat Mycobacterium tuberculosis infection,"Batabyal, S.; Urdahl, K.; Ganusov, V. V."
2026-05-17,20,10.64898/2026.05.15.26347859,1,epidemiology,"Who infected the reported cases? Evidence from 678,482 COVID-19 cases with identified infector collected in routine surveillance in the Netherlands, 2020-2022.","Backer, J. A.; Leung, K. Y.; Andeweg, S. P.; Van de Kassteele, J.; Veldhuijzen, I.; Hahne, S.; Wallinga, J."
2026-05-17,20,10.64898/2026.05.12.26353060,1,public and global health,"Community awareness, access, and experiences of cervical screening following universal access to self-collection in Australia","Jennett, C. J.; Bavor, C.; Saunders, T.; Whop, L. J.; Mitchell, L. E.; Canfell, K.; Taylor, N.; Velentzis, L.; Egger, S.; Brotherton, J. M.; Nightingale, C.; Smith, M. A."
