Date,ISOWeek,DOI,Version,Category,Title,Authors
2026-04-27,18,10.1101/2025.11.06.686941,2,animal behavior and cognition,Experimental evidence of male-male interaction in laboratory swarms of Anopheles gambiae mosquitoes,"Iacomelli, G.; Lombardi, M.; Parisi, L.; Fiorini, M.; Grucci, F.; Lavorgna, A.; Ligato, M.; Zarcone, G.; Peirce, M. J.; Melillo, S.; Spaccapelo, R."
2026-04-27,18,10.64898/2026.04.21.719852,2,bioengineering,DNA-Based Nanoprobes for Fluorescence K+ Sensing in Neural Systems,"Dunn, B.; Farag, S.; Azizi, M.; McAuliffe, L.; Cressman, J. R.; Veneziano, R.; Chitnis, P. V."
2026-04-27,18,10.64898/2026.03.06.708946,2,biophysics,A Modular Framework for Automated Segmentation and Analysis of AFM Imaging of Chromatin Organization,"Sorensen, E. W.; Pangeni, S.; Merino-Urteaga, R.; Murray, P. J.; Rudnizky, S.; Liao, T.-W.; Rashid, F.; Hwang, J.; Yamadi, M.; Feng, X. A.; Zähringer, J.; Gu, S.; Davidson, I. F.; Caccianini, L.; Osorio-Valeriano, M.; Farnung, L.; Vos, S.; Peters, J.-M.; Berger, J. M.; Wu, C.; Hatzakis, N. S.; Kirkegaard, J. B.; Ha, T."
2026-04-27,18,10.64898/2026.03.06.710029,2,zoology,Wing pitch timing and wing elevation modulate forces and body pitch in forward flapping flight,"Colognesi, V.; Johansson, C."
2026-04-27,18,10.64898/2026.01.29.702536,2,ecology,Bottom trawling impacts on faunal and microbial communities increase seafloor carbon loss,"Bonthond, G.; Beermann, J.; Wrede, A.; Sidorenko, V.; Schupp, P. J.; Gutow, L."
2026-04-27,18,10.1101/2025.11.03.686160,2,genomics,Multi-ancestry Transcriptome-Wide Association Study Reveals Shared and Population-Specific Genetic Effects in Alzheimer's Disease,"Sun, X.; Mews, M.; Wheeler, N. R.; Benchek, P.; Gu, T.; Gomez, L.; Ray, N.; Reitz, C.; Naj, A. C.; Below, J. E.; Tosto, G.; Cornejo-Olivas, M.; Byrd, G. S.; Feliciano-Astacio, B. E.; Celis, K.; Rajabli, F.; Kunkle, B. W.; Pericak-Vance, M. A.; Haines, J. L.; Griswold, A. J.; Bush, W. S."
2026-04-27,18,10.1101/2025.09.11.675577,2,animal behavior and cognition,Communication networks of wild zebra finches (Taeniopygia castanotis),"Hagedoorn, K.; Tschirren, N.; ter Avest, E.; Tyson, C.; Snijders, L.; Griffith, S. C.; Naguib, M.; Loning, H."
2026-04-27,18,10.1101/2025.01.21.634178,4,biochemistry,Investigation of Disease-Relevant Lysine Acetylation Sites in α-Synuclein Enabled by Non-canonical Amino Acid Mutagenesis,"Shimogawa, M.; Li, M.-H.; Park, G. S. H.; Ramirez, J.; Lee, H.; Watson, P.; Sharma, S.; Lin, Z.; Peng, C.; Lee, V. M.- Y.; Garcia, B.; Christianson, D. W.; Eliezer, D.; Rhoades, E.; Petersson, E. J."
2026-04-27,18,10.64898/2026.04.21.719937,2,bioengineering,A High-Throughput Platform for Rapid Adaptation of DNA Aptamers to SARS-CoV-2 Evolution,"He, Y.; Yang, Z.; Kuo, Y.-A.; Wu, Y.; Fonseca-Albert, D.; Le, K. K.; Guo, J. G.; Wang, Y.; Nguyen, A.-T.; Chen, Y.-I.; Kim, S.; Chen, W.-R.; Seifi, S.; Hong, S.; Nguyen, T. D.; Chen, Y.; Ren, P.; Lu, Y.; Yeh, H.-C."
2026-04-27,18,10.1101/2025.07.01.662355,2,bioinformatics,Combining AI structure prediction and integrative modelling for nanobody-antigen complexes,"Sanchez-Marin, M.; Giulini, M.; Bonvin, A."
2026-04-27,18,10.64898/2026.04.22.720181,2,biophysics,Mechanical organization yields degenerate dissipation beyond linear response,"Sun, Z. G.; Zheng, J.; Tabatabai, A. P.; Vlassak, J.; Murrell, M."
2026-04-27,18,10.1101/2025.11.18.688995,2,cancer biology,GPCR-Gαq Signaling Drives Adaptive Resistance to MEK Inhibition in BRAF-Mutant Melanoma,"Ke, J.; Wang, Z.; Guo, Z.; Ou, G.; Li, W."
2026-04-27,18,10.64898/2025.12.10.693401,2,neuroscience,Peripheral CB1R inhibition modulates food intake and metabolic efficiency in obesity independently of the gut-brain vagal axis,"Onimus, O.; de Almeida, C.; Bertrand, B.; Castel, J.; Mashhour, N.; Ansoult, A.; Luquet, S.; Gangarossa, G."
2026-04-27,18,10.1101/2025.08.18.670780,2,neuroscience,Sleep Renormalizes Negative Emotional Generalization,"Bar, E.; Bringmann, M.; Belonosov, G.; Aberg, K.; Weissgross, R.; Nir, Y.; Paz, R."
2026-04-27,18,10.1101/2023.06.25.546469,4,neuroscience,"A Bioluminescent Activity Dependent Platform, BLADe, for Converting Intracellular Activity to Photoreceptor Activation","Crespo, E. L.; Pal, A.; Prakash, M.; Silvagnoli, A. D.; Zaidi, Z.; Gomez-Ramirez, M.; Tree, M. O.; Shaner, N. C.; Lipscombe, D.; Moore, C. I.; Hochgeschwender, U."
2026-04-27,18,10.64898/2025.12.11.693822,2,cell biology,The protein turnover and trafficking of Chlamyopsin6 is regulated by IFT88 and IFT52 in the Chlamydomonas reinhardtii,"Sushmita, K.; Sharma, S.; Singh, R.; KATERIYA, S."
2026-04-27,18,10.1101/2025.02.04.636058,3,cell biology,Stress Granule Sequestration of CCR4-NOT Promotes Poly(A) Lengthening of Stress-Survival Transcripts,"Tsai, Y.-C.; Uechi, H.; Millar, S. R.; Kadijk, E.; Minkovich, A.; Ouyang, J. P. T.; Schreiber, K. J.; Huang, J. Q.; Lyons, C. A.; Kasmaeifar, V.; Zhang, Z.; Barsacchi, R.; Möbius, C.; Janosch, A.; Savage, J. C.; Rissland, O. S.; Röst, H.; Hyman, A. A.; Youn, J.-Y."
2026-04-27,18,10.64898/2026.04.21.719958,2,biophysics,Prebiotic Selection as a Physical Process: An Information Quasi-Potential Framework for Chemical Convergence,"Truong, Q. H. X.; Truong, X. K."
2026-04-27,18,10.1101/2025.03.10.642426,2,cancer biology,Microenvironmental arginine restriction sensitizes pancreatic cancers to polyunsaturated fatty acids by suppression of lipid synthesis,"Jonker, P. B.; Sadullozoda, M.; Cognet, G.; Saab, J. J. A.; Sokol, K. H.; Wu, V. X.; Kumari, D.; Sheehan, C.; Ozgurses, M. E.; Agovino, D.; Croley, G.; Dzierozynski, L. N.; Cai, C.; Ziolkowski, L. M.; Patel, S. A.; Bock-Hughes, A.; Macleod, K. F.; Shah, H.; Coloff, J. L.; Lien, E. C.; Muir, A."
2026-04-27,18,10.1101/2024.10.15.618147,2,neuroscience,Extensive monolayer formation after transplantation depends on a RPE subpopulation derived from human iPSCs,"Tessmer, K.; Gasparini, S. J.; Schmidtke, K.; Hammer, J.; Adhikari, T.; Michalke, L.; Schoen, A.; Loureiro, L.; Last, A.; Chelius, N.; Kurtz, A.; Johannsen, H.; Carido, M.; Ferguson, S.; Petzold, A.; Friedrich, U. A.; Kurth, T.; Dahl, A.; Feldmann, A.; Almedawar, S.; Knoebel, S.; Ader, M."
2026-04-27,18,10.1101/2023.01.04.522802,2,neuroscience,BundleWarp: Enhancing White Matter Tractometry and Morphometry with Precise Neuronal Mapping using Streamline-based Nonlinear Registration,"Chandio, B. Q.; Olivetti, E.; Romero, D.; Thomopoulos, S. I.; Villalon-Reina, J. E.; Nir, T. M.; Harezlak, J.; Thompson, P. M.; Garyfallidis, E."
2026-04-27,18,10.64898/2025.12.04.691931,3,immunology,Gut microbial interaction networks control autoimmunity to neuroretina,"Zhang, A.; Horai, R.; Jittayasothorn, Y.; Badger, J. H.; Wu, Z.; Shi, G.; Gupta, A.; Arunkumar, S.; Murphy, C. E.; Nagarajan, V.; McCulloch, J. A.; Kodati, S.; Sen, H. N.; Lee, J. W.; Jacobs, J. P.; Xu, X.; Mattapallil, M. J.; Peng, Z.; Xu, B.; Palmer, R. J.; Majdalani, N.; Honda, K.; O'hUigin, C.; Caspi, R. R."
2026-04-27,18,10.64898/2026.01.14.699556,3,immunology,Molecular heterogeneity and differential metabolic signatures in thymic adipocytes,"Schwakopf, J.; Syage, A. R.; Franzini, A.; Varley, K. E.; Tantin, D."
2026-04-27,18,10.1101/2023.08.12.552953,2,evolutionary biology,Sexually dimorphic leading-edge serrations evolved with sperm competition in silent swallows,"Hasegawa, M."
2026-04-27,18,10.1101/2024.05.23.595630,3,genomics,Designing DNA With Tunable Regulatory Activity Using Discrete Diffusion,"Sarkar, A.; Duran, A.; Yu, Y.; Lin, D.-W.; Kang, Y.; Somia, N.; Mantilla, P.; Zhou, J. L.; Nagai, M.; Tang, Z.; Hanington, K.; Chang, K.; Koo, P."
2026-04-27,18,10.1101/2025.11.27.690895,4,bioinformatics,A Robust and Integrated Framework for Cross-platform Adaptation of Epigenetic Clocks in Cell-free DNA Sequencing,"Li, G.; Huang, W.; Zhao, X.; Wu, J.; Guo, Y.; Chen, L.; Cao, X.; Yang, Z.; Jiang, S.; Hu, B.; Wang, Y.; Tan, D.; Tong, V.; Tang, C.; Feng, X.; Hu, X.; Ouyang, C.; Zhou, G."
2026-04-27,18,10.1101/2025.09.12.672331,2,bioinformatics,Risk Based Prediction of Novel AMR Variants Using Protein Language Models,"Wood, J. J.; Portelli, S.; Ascher, D. B.; Furnham, N."
2026-04-27,18,10.64898/2026.04.16.718914,2,biophysics,Zero-Shot Generation of Protein Conformational Ensembles Through AlphaFold Latent Flooding,"QIAN, R.; Zhan, R.; Song, Z.; Huang, J."
2026-04-27,18,10.64898/2026.02.07.704521,2,biophysics,Structural basis of broadly neutralizing human antibodies targeting diverse dengue virus forms.,"Mangala Prasad, V.; Chatterjee, A.; Roy, A.; Srinivasan, S.; Charles, S.; Lubow, J.; goo, l."
2026-04-27,18,10.1101/2023.11.03.565535,3,cancer biology,Early NOTCH1 mutation is positively selected but epistatically suppresses evolution of later esophageal squamous-cell carcinoma drivers,"Glasmacher, K. A.; Mandell, J. D.; Jackson, M.; Fisk, N.; Cannataro, V. L.; Townsend, J. P."
2026-04-27,18,10.1101/2025.11.19.689397,2,microbiology,Omicron evolution drives increased ciliated cell tropism and dysfunction in nasal epithelia.,"Mostafavi, H.; Parry, R.; McCallum, G.; Sng, J. D. J.; Joensuu, M.; Short, K. R.; Slonchak, A.; Khromykh, A."
2026-04-27,18,10.64898/2025.12.04.692398,3,bioinformatics,Uniform pre-processing of bacterial single-cell RNA-seq,"Oakes, C. G.; Beilinson, V.; McFall-Ngai, M. J.; Pachter, L. G."
2026-04-27,18,10.64898/2026.04.14.718570,2,cancer biology,Modeling VEGF and GLUT1 Expression as Coadapted Foraging Strategies in Cancer,"Bhattacharya, R.; Gatenby, R. A.; Brown, J. S."
2026-04-27,18,10.64898/2026.01.06.697891,2,neuroscience,How are different contrast effects on binocular luster spatially integrated?,"Wendt, G.; Faul, F."
2026-04-27,18,10.64898/2026.04.23.720378,1,ecology,Electric signal polymorphism predicts dietary niche partitioning in a weakly electric fish,"Picq, S.; Gorsuch, R.; Bills, R.; Koenig, L.; Ngoua Aba'a, N.; Nzigou, F.; Mipounga, H. K.; Knobloch, E. C.; Schmidt, R. C.; Parkanzky, E.; Benbow, M. E.; Gallant, J. R."
2026-04-27,18,10.64898/2026.04.23.720231,1,bioengineering,"High-throughput, organ-scale 3D tubule tracking using TubuleMAP","Poudel, C.; Brenes, D.; Xie, W.; Guan, Y.; Vasquez, P.; Mahadevan, N.; Konatham, E.; Fan, N.; Guo, Z.; Porter, N. J.; Wong, M. K.; Martinez, M. M.; Sandoval, R. M.; Dunn, K. W.; Dagher, P. C.; Eng, D. G.; Shankland, S. J.; Liu, J. T. C.; Vaughan, J. C."
2026-04-27,18,10.64898/2026.04.27.721111,1,cancer biology,Macrophage-Derived PDGF-BB and GDF-15 Promote Drug Resistance in KRAS-Mutant Colorectal Cancer,"Aston, B. S.; Badmos, H. A.; Cagan, R."
2026-04-27,18,10.64898/2026.04.23.719809,1,plant biology,Subcellular dynamics of leghemoglobin is modulated by its site-specific serine phosphorylation during symbiotic nitrogen fixation in Lotus japonicus,"ASHRAFI, M. A.; DAS, A.; SIDDHANTA, A."
2026-04-27,18,10.64898/2026.04.23.720413,1,plant biology,The segregase CDC48 integrates blue light and hormonal cues to regulate photomorphogenesis in Arabidopsis,"Alem, A. L.; Arce, A. L.; Blanchard, C.; Gomez, M. D.; Carrera, E.; Lamotte, O.; Perez-Amador, M. A.; Capella, M."
2026-04-27,18,10.64898/2026.04.23.720389,1,plant biology,Metabolic commitment and nitrogen control of diazotrophy in the diazoplast-containing diatom Epithemia adnata,"Sanchez, A. O.; Antolin, I.; Do Nascimento, M.; Sanchez Rizza, L.; Mechaly, A. S.; Lopez-Garcia, A.; Gonzalez-Bodi, S.; Huerta Cepas, J.; Flores, E.; Rubio, L. M.; Curatti, L."
2026-04-27,18,10.64898/2026.04.23.719924,1,neuroscience,Chemoarchitectural influences on the cortical connectome confer resilience in aging,"Flores-Alonso, S. I.; Solomon, J. P.; Dobri, S.; McIntosh, A. R.; Wiesman, A. I."
2026-04-27,18,10.64898/2026.04.23.720385,1,neuroscience,Subcellular Localization of Dopamine D1 and D2 Receptors in the Mouse Hippocampus,"Swope, C.; Sommer, G.; Smith, R.; Milner, T.; Platholi, J."
2026-04-27,18,10.64898/2026.04.23.720454,1,ecology,Shifts in consumer assemblages are linked to nutrient availability and ecosystem metabolism,"Sadler, I.; Stanley, A.; Narr, C. F."
2026-04-27,18,10.64898/2026.04.23.718589,1,animal behavior and cognition,A synthesis of the evidence for the acoustic space partitioning hypothesis,"Gonzalez, K.; Leavell, B. C.; Lucas, J. R.; Bernal, X. E."
2026-04-27,18,10.64898/2026.04.23.720095,1,bioengineering,In Vitro Fertilization using Magnetotactic Sperm Cells,"Ribeiro, C.; Striggow, F.; Nauber, R.; Hebenstreit, F.; Schoen, J.; Medina-Sanchez, M."
2026-04-27,18,10.64898/2026.04.23.720434,1,biophysics,Organization of Myosin H in the Apical Complex of Toxoplasma Gondii Revealed by 3D Single-Molecule Super-Resolution Microscopy,"Balaji, A.; Segev Zarko, L.-a.; Barentine, A. E. S.; Boothroyd, J. C.; Moerner, W. E."
2026-04-27,18,10.64898/2026.04.23.717949,1,neuroscience,Cell-state mapping reveals a reversible neuroblast accumulation in the aging mouse hippocampus,"Rasetto, N.; Herrero, M.; Berardino, A.; Dibella, D.; Giacomini, D.; Trinchero, M.; Arlotta, P.; Chernomoretz, A.; Schinder, A."
2026-04-27,18,10.64898/2026.04.23.720435,1,immunology,Human lung γδ T cells maintain functionality during inflammatory lung disease,"Taber, A.; Frutoso, M.; Potchen, N.; Koehne, A. L.; Schmitz, C.; Morrell, E. D.; Prlic, M.; Wright, S. W."
