Date,ISOWeek,DOI,Version,Category,Title,Authors
2026-04-16,16,10.64898/2026.04.14.718488,1,bioinformatics,MICRON learns outcome-associated representations of spatial immune microenvironments,"Chen, C.-J.; George, B.; Dhawka, L.; Evangelista, B.; Stanley, N."
2026-04-16,16,10.64898/2026.04.14.718479,1,bioinformatics,ProteomeScan: A Toolkit For Target Validation By Proteome-Wide Docking And Analysis,"Barsainyan, A. A.; Panda, R.; Siguenza, J.; Merico, D.; Ramsundar, B."
2026-04-16,16,10.64898/2026.04.13.717676,1,biophysics,Proteome-wide identification and modeling of interactions between transactivation domains and arginine-glycine-rich regions,"Khanna, Y.; Hajdarevic, A.; Pirchner, J.; Usluer, S.; Rakhimbekova, A.; Pritisanac, I.; von Buelow, S.; Lindorff-Larsen, K.; Madl, T."
2026-04-16,16,10.64898/2026.04.14.718421,1,plant biology,The Posidonia oceanica Large PSI-LHCII supercomplex reveals the molecular basis of PSI spectral diversification in higher plants,"Charras-Ferroussier, Q.; Alsenani, T.; Al-Amoudi, A.; Siponen, M. I.; Heilmann, E.; Naschberger, A.; Jungas, C."
2026-04-16,16,10.64898/2026.04.15.718846,1,microbiology,Microbiome-Targeted Reduction of Circulating Trimethylamine N-Oxide Mitigates Ischemic Stroke Risk,"You, J. S.; Yoon, C. E.; Kim, J. B.; Alrahman, M. A.; Jung, H. Y.; Yoon, M. Y.; Kim, Y. B.; Lee, S.-G.; Nam, H. S.; Yoon, S. S."
2026-04-16,16,10.64898/2026.04.16.718884,1,microbiology,Oropouche virus causes acute hepatitis in mice controlled by Type I interferons,"Sterling, C. E.; Rush, R. E.; McGaughey, J.; Snow, B. A.; Benton, A. J.; Duprex, W. P.; Amarasinghe, G.; Monga, S. P.; Hartman, A. L."
2026-04-16,16,10.64898/2026.04.14.718541,1,molecular biology,HIV and Cocaine exposure promote Tau phosphorylation through RSK-1 in a GSK3β-independent manner.,"Sharma, A. L.; Sariyer, I. K.; Naik, U. P.; Tyagi, M."
2026-04-16,16,10.64898/2026.04.14.718450,1,developmental biology,LRRTM4 controls cell migration via Glypican interactions,"Peregrina, C.; Berbeira-Santana, M.; Carrasquero, M.; Rodriguez-Navarro, I.; El Omari, K.; Li, H.-Y.; Seyit-Bremer, G.; Klein, R.; Castellani, V.; Seiradake, E.; del Toro, D."
2026-04-16,16,10.64898/2026.04.13.712063,1,ecology,Coral reef ecosystem functions in a human-dominated world,"Parravicini, V.; McWilliam, M.; Schiettekatte, N. M.; Carlot, J.; Morais, R. A.; Barneche, D. R.; Karkarey, R.; Adjeroud, M.; Burkepile, D. E.; Casey, J. M.; Dornelas, M.; Edgar, G. J.; Exton, D. A.; Graham, N. A.; Keith, S. A.; Madin, J. S.; Maire, E.; Mouillot, D.; Mouquet, N.; Stuart-Smith, R. D.; Strona, G.; Villeger, S.; Wilson, S. K.; Brandl, S. J."
2026-04-16,16,10.64898/2026.04.14.718485,1,bioinformatics,Inferring division-associated stochasticity from time-series single-cell transcriptomes,"Okochi, Y.; Sawazaki, Y.; Kondo, Y.; Naoki, H."
2026-04-16,16,10.64898/2026.04.13.715198,1,bioinformatics,Canonical self-supervised pretraining paradigm constrains the capacity of genomic language models on regulatory decoding,"Liang, Y.-X.; Wang, Y.; Pan, W.-Y.; Chen, Z.-Y.; Wei, J.-C.; Gao, G."
2026-04-16,16,10.64898/2026.04.15.718660,1,neuroscience,Consolidation Separates Implicit and Explicit Components of Compound Motor Memories,"Kumar, A. D.; Kumar, A.; Kumar, N."
2026-04-16,16,10.64898/2026.04.14.718565,1,neuroscience,A Systematic Characterization of Causal Interactions Between Human Visual Areas,"Yanez-Ramos, M. G.; Ojeda Valencia, G. A.; Huang, H.; Gregg, N. M.; Bilderbeek, J. A.; Montoya, M.; Kay, K. A.; Worrell, G.; Miller, K. J.; Hermes, D."
2026-04-16,16,10.64898/2026.04.15.718699,1,neuroscience,Cortical Layer 6b Persistent Subplate Neurons Reciprocally Connect Sensorimotor Areas and Inversely Reflect Somatosensory Engagement,"Khalid, R.; Masini, D.; Locarno, A.; Netsyk, O.; Lorentz, J.; Broberger, C."
2026-04-16,16,10.64898/2026.04.14.718598,1,molecular biology,Distribution and p300/CBP dependency of cis-regulatory elements are encoded by unique combinations of histone lactylation and acetylation,"Komatsu, T.; Inagaki, T."
2026-04-16,16,10.64898/2026.04.13.717197,1,molecular biology,Preservation of full-length transcripts at ambient temperature using ensilication,"Muraleedharan, M.; Gowda, H.; Banal, J."
2026-04-16,16,10.64898/2026.04.15.718734,1,evolutionary biology,Cumulative Cultural Evolution in Structured Populations,"Leite, R. N.; Reia, S. M.; Mesoudi, A.; Campos, P. R."
2026-04-16,16,10.64898/2026.04.15.718682,1,genetics,"Strong inhibition of insulin/IGF-1 signaling in early-mid adulthood compresses morbidity, but in later life accelerates aging","Zhang, B.; Hsiung, K. C.; Biju, R.; Cameron-Pack, M.; Wei, X.; Chapman, H.; Kelaj, M.; Zhang, A.; Nguyen Hong, C.; Ewald, C. Y.; Gems, D."
2026-04-16,16,10.64898/2026.04.15.718745,1,genetics,Humanized Klotho haplotypes cause widespread transcriptomic changes in mouse brain,"Tyler, A. L.; Garceau, D.; Kotredes, K. P.; Haber, A.; Spruce, C.; Pandey, R. S.; Preuss, C.; Sasner, M. J.; Carter, G. W."
2026-04-16,16,10.64898/2026.04.15.718677,1,genomics,Histone H1 Variants Regulate Neurodevelopmental Transcriptional Programs in Autism with 16p11.2 deletion,"Brudno, R.; Askayo, D.; Khair, D.; Shayevitch, R.; Keydar, I.; Zmudjak-Olevson, M.; Lev-Maor, G.; Zavolan, M.; Elkon, R.; Ast, G."
2026-04-16,16,10.64898/2026.04.16.718917,1,genomics,Ancestral Genome Reconstruction.,"Siguret, C.; Olivier, M.; Huneau, C.; SOW, M. D.; Stenger, P.-L.; Klopp, C.; Martin, M.-L.; Tamby, J.-P.; Civan, P.; Pont, C.; Mathieu, O.; SALSE, J."
2026-04-16,16,10.64898/2026.04.15.718798,1,neuroscience,Specialized Computations for Generalized World Modelling in Medial Prefrontal Cortex,"Yazin, F.; Majumdar, G.; Lucas, C.; Bramley, N. R.; Hoffman, P."
2026-04-16,16,10.64898/2026.04.16.718904,1,neuroscience,Why the Sleeping Brain Clears,"Kerskens, C."
2026-04-16,16,10.64898/2026.04.15.718666,1,neuroscience,Assembling Neural Latching Switch Circuits for temporally structured behavior,"Dubreuil, A."
2026-04-16,16,10.64898/2026.04.16.718851,1,neuroscience,Multi-area activity in mouse motor cortex associated with one- and two-handed oromanual dexterity,"Barrett, J. M.; Glaser, J. I.; Miri, A.; Shepherd, G. M. G."
2026-04-16,16,10.64898/2026.04.15.718826,1,neuroscience,Reduced cortico-accumbal excitatory input due to Nav1.2 haploinsufficiency impairs sociability independently of dopamine,"Suzuki, T.; Tominaga, S.; Yokoi, Y.; Mizukami, H.; Kobayashi, K.; Nishida, W.; Yamashita, K.; Kondo, T.; Hibi, Y.; Yamagata, T.; Itohara, S.; Nomura, H.; Hida, H.; Yamakawa, K."
2026-04-16,16,10.64898/2026.04.16.718849,1,neuroscience,Emotional reactivity to aversive primes impedes motor preparatory activity in functional neurological disorders,"Mazzola, V."
2026-04-16,16,10.64898/2026.04.16.718920,1,neuroscience,Slow-Rate Temporal Sampling Deficits During Naturalistic Speech Listening in Children with Developmental Language Disorder,"Keshavarzi, M.; Feltham, G.; Richards, S.; Parvez, L.; Goswami, U."
2026-04-16,16,10.64898/2026.04.16.718661,1,neuroscience,Latent neural network representations of the brain reflect broad-scale adolescent phenotypic variation,"Dahl, A.; Leonardsen, E. H.; Alnaes, D.; Westlye, L. T."
2026-04-16,16,10.64898/2026.04.16.718874,1,evolutionary biology,LAVA: a method for identifying local and global adaptation in structured populations,"do O, I.; Bachmann Salvy, M.; Gaggiotti, O. E.; Goudet, J.; de Villemereuil, P."
2026-04-17,16,10.64898/2026.04.15.718719,1,cell biology,Togaram Ensures Axial Alignment of the Sperm Neck,"Burns, E. E.; Burr, S. E.; Holmes, K. H. M.; Fagerstrom, C. J.; Rusan, N. M."
2026-04-17,16,10.64898/2026.04.15.718800,1,cell biology,Arachidonic acid availability controls neutrophil swarm initiation and scaling,"Strickland, E. D.; Kandaswamy, R.; Zager, P. J.; De Belly, H.; Phillips, T. K.; Hopke, A.; Weiner, O. D."
2026-04-17,16,10.64898/2026.04.15.718686,1,cancer biology,KIF18A Maintains Kinetochore-Microtubule Attachments in CIN Cells by Limiting Microtubule Polymerization,"Fonseca, C.; Fisher, K.; Wagner, E.; Paschall, S.-C.; Kim, H.; Stumpff, J."
2026-04-17,16,10.64898/2026.04.14.718012,1,cell biology,Saturated cardiolipins are potent disruptors of inner mitochondrial membrane structure and function,"Venkatraman, K.; Milshteyn, D.; Sarto, C.; Kocharian, E.; Sakurai, C. M.; Armando, A. M.; Wong, A. M.; Dennis, E. A.; Fang, X.; Lee, C. T.; Budin, I."
2026-04-17,16,10.64898/2026.04.16.718906,1,bioinformatics,Integrating glycosylation in de novo protein design with ReGlyco Binder Design Filter,"Singh, O.; Fadda, E."
2026-04-17,16,10.64898/2026.04.16.717704,1,biophysics,A robust workflow for 3D imaging of human mitochondria using cryo-electron tomography,"Iragavarapu, A. G.; Artemchuk, O.; Bobe, D.; Ratliff, A.; Pavlov, E.; Aydin, H."
2026-04-17,16,10.64898/2026.04.15.718673,1,plant biology,Catalase 2-dependent regulation of autophagy in response to carbon starvation in Arabidopsis,"Zhang, C.; Li, S.-Q.; Jing, P.; Wu, J.-X.; Chen, B.-H.; Liao, C.-Y.; Yang, H.; Lu, K.-K.; Song, R.-F.; Foyer, C. H.; Liu, W.-C."
2026-04-17,16,10.64898/2026.04.15.718623,1,plant biology,Genetic dissection of root-mediated yield heterosis in melon (Cucumis melo),"Dafna, A.; Tzuri, G.; Oren, E.; Isaacson, T.; Halperin, I.; Peleg, G.; Gur, A."
2026-04-17,16,10.64898/2026.04.13.717981,1,plant biology,Circadian Timekeeping in the Tropics: Rhythmic Transcriptome and Diurnal Regulatory Networks in Rubroshorea leprosula,"Singh, S. K.; Seki, M.; Ito, H.; Tani, N.; Ikezaki, Y.; Ohta, K.; Yeoh, S. H.; Ching, N. C.; Satake, A."
2026-04-17,16,10.64898/2026.04.15.717889,1,molecular biology,Disturbed ATP and AMPK homeostasis in an AnkF377del mouse model for craniometaphyseal dysplasia,"Hatori, A.; Sah, S. K.; Wetering, K. v. d.; Reichenberger, E. J.; Chen, I.-P."
2026-04-17,16,10.64898/2026.04.14.718603,1,cell biology,Identification of loop regions as motifs determining cellular and organ chirality in Myosin 1C,"Yamaguchi, A.; Sasamura, T.; Yoshimura, K.; Haraguchi, T.; Mori, T.; Ito, K.; Matsuno, K."
2026-04-17,16,10.64898/2026.04.15.718672,1,cell biology,Dynamic dissociation of the IFT complex drives ciliary dysfunction during C. elegans ageing,"Shen, Y.; Li, J.; Wang, S.; Xie, S.; Chen, M.; Song, M.; Zhang, X.; Tang, J.; Li, Q.; Li, D.; Yan, X."
2026-04-17,16,10.64898/2026.04.15.718829,1,cell biology,Nuclear βactin dependent chromatin accessibility governs stem cell pluripotency and extracellular matrix gene programs to maintain cellular biomechanics for cell lineage decisions,"Campbell, C.; Hosny El Said, N.; Ghassan Al Nuairi, A.; Loganathan, P.; Breunig, C.; Deliorman, M.; Desbordes, S. C.; Lohse, M. J.; Magzoub, M.; Qasaimeh, M. A.; Percipalle, P."
2026-04-17,16,10.64898/2026.04.16.719038,1,cell biology,Lipids Regulate Export of Lysosomal Enzymes from the Endoplasmic Reticulum,"Xia, B.; Han, M.; Park, I.; Perrimon, N."
2026-04-17,16,10.64898/2026.04.15.718729,1,cell biology,Determinants of CCT motif specificity in WNK signaling and expansion of CCT like domains,"Magana-Avila, G.; Rojas-Ortega, E.; Lira-Castaneda, M.; Diaz-Ortiz, I.; Bustamante, J.; Carbajal-Contreras, H.; Rojas-Juarez, E.; Ortega-Prado, R.; Marquez-Salinas, A.; Vazquez, N.; Gamba, G.; Castaneda-Bueno, M."
2026-04-17,16,10.64898/2026.04.15.718713,1,cell biology,Developmental regulation of kinetochore phosphorylation determines mitotic fidelity,"Galaviz Sarmiento, B.; Compton, D. A.; Godek, K. M."
2026-04-17,16,10.64898/2026.04.14.718465,1,cell biology,Adaptation of white adipocytes to cooler temperatures: impacts on energy metabolism and protein acetylation,"Mori, H.; Hariri, H.; Moe, W.; Durham, S.; Guzman, Y.; Paulsson, E.; Simmermon, R.; Bhanderi, P.; Peterson, S.; Dickson, M.; Evans, C.; MacDougald, O. A."
2026-04-17,16,10.64898/2026.04.15.718639,1,ecology,"Targeting Bothrops asper Venom Enzymes: Steroidal Derivatives as potential Inhibitors of Phospholipase A2, Serine proteinases, and metalloproteinases.","Bacho, M.; Rodriguez-Nunez, Y. A.; Guerra, C. J.; Polo-Cuadrado, E.; Soto-Delgado, J.; Restrepo, A. S. T.; Mendez Anacona, J. R.; Henao-Castaneda, I.; Rojo, L. M. P."
2026-04-17,16,10.64898/2026.04.15.718114,1,ecology,TAUS: Target-Age Unified Survival. Survival analysis without assuming proportional hazards or parameterising the survival function.,"Casas Gomez-Uribarri, I.; Babayan, S. A.; Okumu, F.; Baldini, F.; Betancourth, M. P."
2026-04-17,16,10.64898/2026.04.14.718602,1,ecology,Metabolic inequality in microbial communities,"Mueller, E. A.; Lennon, J. T."
2026-04-17,16,10.64898/2026.04.15.718733,1,ecology,Coupling abundance and spatial distribution for an unbiased and tractable beta diversity framework,"Xing, D."
2026-04-17,16,10.64898/2026.04.14.718502,1,ecology,Pollination ecology of a threatened lupine from the core to northern edge of its geographic range,"Blondeau, M. A.; So, C. P.; Hargreaves, A. L."
2026-04-17,16,10.64898/2026.04.14.716867,1,ecology,Population genetics of bumble bee species with diverging population dynamics,"Piovesan, A.; Praz, C.; Voelkl, B.; Lanz, S.; Neumann, P.; Beaureapaire, A."
2026-04-17,16,10.64898/2026.04.15.718781,1,ecology,Co-occurrence networks can preserve emergent properties of ecological communities,"Callahan, F. M.; Evensen, C."
2026-04-17,16,10.64898/2026.04.14.717098,1,ecology,Minimizing co-growth as a broad predictor of community robustness,"Chakraverti-Wuerthwein, M. S.; Matsubara, Y. J.; Roach, F. D.; Narla, A. V.; Hwa, T.; Murugan, A. S."
2026-04-17,16,10.64898/2026.04.14.718518,1,ecology,Epipelagic to mesopelagic variability of acoustic backscatter in the California Current,"Guiet, J.; Wall, C.; Srinivasan, K.; Bianchi, D."
2026-04-17,16,10.64898/2026.04.14.718490,1,ecology,Phenotypic plasticity as a route to population shifts via tipping points,"Fellows, B.; White, S.; Brass, D.; Nascou, A.; Cobbold, C."
2026-04-17,16,10.64898/2026.04.15.718787,1,plant biology,"Successful gene editing in tetraploid alfalfa using the open-source, AI-derived OpenCRISPR-1","Alam, S.; Subedi, U.; Burton Hughes, K.; Chen, G. G.; Da Ros, L.; Bilichak, A.; Singer, S."
2026-04-17,16,10.64898/2026.04.15.718704,1,plant biology,"Sustaining smallholder banana production in Banana Bunchy Top Disease endemic landscapes: integrating clean seed, roguing, and farmer training","Retkute, R.; Omondi, A. B.; Zandjanakou-Tachin, M.; Agoi, U. R.; Staver, C.; Kumar, P. L.; Thomas, J. E.; Gilligan, C. A."
2026-04-17,16,10.64898/2026.04.15.718773,1,plant biology,Discovery of the rosalexin pathway expands the modular network of maize diterpenoid chemical defenses.,"Cowie, A. E.; Wyatt, G.; Schumaker, S. S.; Khalil, A.; Ross, A. S.; Bhattacharjee, S.; Narayanan, J.; Ding, Y.; Hurd, D.; Peek, J. O.; Poretsky, E.; Huffaker, A.; Tantillo, D. J.; Major, D. T.; Schmelz, E. A.; Zerbe, P."
2026-04-17,16,10.64898/2026.04.15.717650,1,plant biology,"Belgian endive-derived biostimulant activity in Arabidopsis, lettuce and sweet pepper at different developmental stages, environmental conditions, and application methods","Ogunsanya, H. Y.; Petit, C.; Audenaert, K.; De Zutter, N.; Geelen, D."
2026-04-17,16,10.64898/2026.04.17.719139,1,developmental biology,Ribosome profiling reveals widespread translational control across developmental stages in the brown alga Ectocarpus,"Leong, J. X. M.; Barrera-Redondo, J.; Haas, F. B.; Igreja, C.; Coelho, S. M."
2026-04-17,16,10.64898/2026.04.15.718810,1,physiology,Revisiting Mouse Cardiac Myocyte Isolation: A Simplified Langendorff-based Method,"Larsen, M. S.; Thomsen, M. B.; Zawadzki, T."
2026-04-17,16,10.64898/2026.04.16.718933,1,neuroscience,Discovering Novel Circuit Mechanisms in Higher Cognition through Factor-Centric Recurrent Neural Network Modeling,"Zhang, Y.; Li, X.; Shen, X.; Li, F.; Okazawa, G.; Wang, L.; Feng, J.; Min, B."
2026-04-17,16,10.64898/2026.04.16.718963,1,neuroscience,Psilocybin reshapes cortical inhibition through selective interneuron recruitment,"Davoudian, P. A.; Jiang, Q.; Knox, C. A.; Savalia, N. K.; Shao, L.-X.; Wilson, J.; Weiner, A. M.; Chong, C. W.; Liao, C.; Nothnagel, J. D.; Sakurai, T.; Kwan, A. C."
2026-04-17,16,10.64898/2026.04.16.718970,1,neuroscience,Hippocampal and Midbrain Function in Superagers Relates to Memory for Novelty and Expectation Violation,"Garcia Huescar, M.; Zhang, L.; Strange, B.; Frank, D."
2026-04-17,16,10.64898/2026.04.16.718911,1,neuroscience,Fronto-Temporal Dysconnectivity and Cortical Excitability in High Schizotypy: Associations with Symptom Dimensions,"Hauke, D. J.; Iseli, G. C.; Rodriguez-Sanchez, J.; Stone, J. M.; Coynel, D.; Adams, R. A.; Schmidt, A."
2026-04-17,16,10.64898/2026.04.14.718584,1,neuroscience,Multiscale Mechanisms of Human Memory Modulation by Deep Brain Stimulation,"LI, Y.; Gao, Y.; Li, T.; Peng, X.; Zhang, L.; Yang, G.; He, L.; Axmacher, N.; Yu, T.; Xue, G."
2026-04-17,16,10.64898/2026.04.15.718775,1,molecular biology,"Detecting misfolded non-covalent lasso entanglements in protein structures, simulation trajectories, and mass spectrometry data","Sitarik, I.; Jiang, Y.; Song, H.; O'Brien, E. P."
2026-04-17,16,10.64898/2026.04.16.719007,1,cell biology,Lysosomal Profiling with LysoTracker for Quantitative Assessment of Cellular Senescence in Human Fibroblasts,"Estrada, J.; Tenenbaum, S.; Larsen, M.; Begley, T.; Melendez, J. A."
2026-04-17,16,10.64898/2026.04.16.718892,1,cell biology,"A neuropsychiatric disease-associated mutation in LRRC8B disrupts cellular calcium signaling, mitochondrial function, and bioenergetics","Ajith, A.; S, D. S.; Sharma, R.; Ghosh, A. K.; Bera, A. K."
2026-04-17,16,10.64898/2026.04.16.718233,1,evolutionary biology,Evolutionary landscapes of zygotic genome activation across animals,"Campo-Bes, I.; Mantica, F.; Permanyer, J.; Rodriguez-Marin, C.; Guynes, K.; Senar-Serra, T.; Quiroga-Artigas, G.; Liang, Y.; Carrillo-Baltodano, A. M.; Cruz, J.; Annunziata, R.; Chevalier, S.; Iglesias, M.; Sugahara, F.; Luo, Y.-J.; Schoenauer, A.; Corbacho, J.; Paganos, P.; Caccavale, F.; Sepe, R. M.; Iniguez, L. P.; Handberg-Thorsager, M.; Zakas, C.; Sommer, R. J.; Arnone, M. I.; McGregor, A. P.; Martinez-Morales, J. R.; Satoh, N.; Escriva, H.; Bertrand, S.; Sebe-Pedros, A.; D'Aniello, E.; Pascual-Anaya, J.; Houliston, E.; Franch-Marro, X.; Martin, D.; Somorjai, I. M. L.; Almudi, I.; Martin-"
2026-04-17,16,10.64898/2026.04.15.718501,1,genomics,Whole-genome 3D architectural screen reveals modulators of brain DNA structure,"Parasar, B.; Raja Venkatesh, A.; Perera, J.; Sosnick, L.; Moghadami, S.; Seo, Y.; Shi, J.; Chan, L.; Takenawa, S.; Akiyama, T.; Sianto, O.; Uenaka, T.; Hadjipanayis, A.; Wernig, M.; Gitler, A. D.; Tan, L."
2026-04-17,16,10.64898/2026.04.15.718791,1,scientific communication and education,Statistical invisibility of working equids in Mexico: Dissecting the gap between global diagnostics and official data (1970-2022).,"Garcia-Seco, E.; Diaz, M. A.; Tadich Gallo, T.; Toribio, R. E.; Galindo Maldonado, F.; Hernandez-Gil, M."
2026-04-17,16,10.64898/2026.04.16.719061,1,neuroscience,Comparative lifespan trajectories of brain energy metabolism in human and macaque,"Pourmajidian, M.; Misic, B.; Dagher, A."
2026-04-17,16,10.64898/2026.04.16.718991,1,neuroscience,Early life stress exposure alters brain vasculature transcriptomic profiles in areas regulating stress resilience,"Solano, J. L.; Daigle, B.; Lebel, M.; Pena, C. J.; Menard, C."
2026-04-17,16,10.64898/2026.04.16.718928,1,neuroscience,Comprehensive single cell profiling of ageing glial cells reveals impaired Wnt signalling and Jun transcription factors regulating cortical astrocytes,"Hennes, M.; Thorwirth, M.; Lao, C. L.; Stogsdill, J. A.; Arlotta, P.; Fischer-Sternjak, J.; Richter, M. L.; Goetz, M."
2026-04-17,16,10.64898/2026.04.16.719013,1,neuroscience,Hypothalamic Interleukin 6 linked to sex-specific behavioral deficits following adolescent social isolation,"Mishra, C.; Gupta, A.; Pillai, B.; Konar, A."
2026-04-17,16,10.64898/2026.04.16.719010,1,neuroscience,Perinatal cannabidiol exposure reshapes astrocyte morphology and tripartite synapse organization in a sex-dependent manner,"Dias de Abreu, G. H.; Wilson, J.; Ritzmann, V.; Moosbrugger, O. J.; Johnson, C. T.; Mackie, K.; Bradshaw, H.; Huang, J.-Y.; Lu, H.-C."
2026-04-17,16,10.64898/2026.04.16.719083,1,neuroscience,An inhibitory circuit motif governs oscillation-dependent coupling between aperiodic activity and neural spiking,"Helfrich, J. D.; Veit, J.; Helfrich, R. F."
2026-04-17,16,10.64898/2026.04.16.719074,1,neuroscience,Mid-superior temporal sulcus encodes spatial context and behavioral state in freely moving macaques,"Parodi, F.; Lamacchia, A. P.; Ye, Y.; Laamerad, P.; Chen, Y.; Gardiner, K. L.; Tremblay, S.; Kording, K. P.; Platt, M. L."
2026-04-17,16,10.64898/2026.04.16.718870,1,neuroscience,Towards patient-specific biomechanical human brain models,"Tueni, N.; Rauh, B.; Hinrichsen, J.; Rampp, S.; Doerfler, A.; Budday, S."
2026-04-17,16,10.64898/2026.04.13.717827,1,immunology,Multi-omic profiling of human antibody-secreting cells reveals diverse subsets sustain durable humoral immunity,"Glass, D. R.; Dornisch, E. M.; Yin, H.; Ludmann, S. A.; Samudre, A.; Kuhl, S.; Malone, J.; Chander, A.; Kaul, S. N.; Phalen, C. G.; Parthasarathy, V.; Dillon, M. A.; Genge, P. C.; Stuckey, T. J.; Anover-Sombke, S. D.; Wittig, P. J.; Pebworth, M.-P.; He, Z.; Henderson, K. E.; Ravisankar, P.; Hernandez, V.; Musgrove, B.; Mishra, S.; Krishnan, U.; Thomson, Z. J.; Weiss, M.; Estep, N.; Graybuck, L. T.; Angus-Hill, M. L.; Gustafson, C. E.; Kopp, M. S.; Reading, J.; Li, X.-j.; Viana, M. P.; Bumol, T. F.; Goldrath, A. W.; Sigvardsson, M.; Bendall, S. C.; Skene, P. J.; Green, D. J.; Newell, E. W.; Tor"
2026-04-17,16,10.64898/2026.04.13.716763,1,animal behavior and cognition,Modeling Synthetic Audience Reactions to Social-Cognitive Narratives: A Generative GSR Model to Predict Real-World Autonomic Alignment during Film Viewing,"Bartling, B. A.; Schmaelzle, R.; Cho, H. J.; Du, Y."
2026-04-17,16,10.64898/2026.04.13.715606,1,bioengineering,Engineering autologous ossicles for the personalized modeling of acute myeloid leukemia,"Sauter, C.; Zacharaki, D.; Garcia Garcia, A.; Hidalgo Gil, D.; Li, Y.; Grigoryan, A.; Gabriel, M.; Baudet, A.; Gonzalez Anton, S.; Cammenga, J.; Lazarevic, V.; Bourgine, P. E."
2026-04-17,16,10.64898/2026.04.13.717344,1,bioengineering,Engineering in vitro models of skeletal muscle with neuromuscular junctions using hierarchical micro-nano biomaterials: Cooperative effect of adhesion ligand nanoclustering and surface anisotropy,"Nour, S.; Swiderski, K.; Salehi, S.; Lynch, G. S.; O'Connor, A. J.; Qiao, G. G.; Heath, D. E."
2026-04-17,16,10.64898/2026.04.13.717816,1,bioinformatics,Agent-Guided De Novo Design of Nanobody Binders Against a Novel Cancer Target,"Zhao, Y.; Yilmaz, M.; Lee, E.; Teh, C.; Guo, L.; Sonmez, K.; Giancardo, L.; Trang, G.; Xu, F.; Espinosa-Cotton, M.; Cheung, N.-K.; Kim, J.; Cheng, X."
2026-04-17,16,10.64898/2026.04.13.717771,1,cancer biology,Multimodal immunopharmacologic screens identify drugs rewiring the cancer-immune interface,"Bouhlal, J.; Jokinen, E.; Nygren, P.; Dias, D.; Ianevski, A.; Klievink, J.; Lähteenmäki, H.; Decombis, S.; Duan, H.; Järvelä, E.; Saarinen, E.; Näätänen, A.; Matjusinski, K.; Kasanen, T.; Hannunen, T.; Turunen, L.; Myllymäki, M.; Laajala, E.; Schenkwein, D.; Ylä-Herttuala, S.; Flagship, i.; Lee, D. A.; Korhonen, M.; Göös, H.; Aittokallio, T.; Hollmen, M.; Mitsiades, C.; Gandolfi, S.; Dufva, O.; Mustjoki, S."
2026-04-17,16,10.64898/2026.04.13.717813,1,cancer biology,Identification of Bone Morphogenetic Protein 7 as a Master Regulator of Gastric Cancer-Associated Cachexia,"Yasuda-Koiwa, M.; Shoda, T.; Nishimura, A.; Yasuda, T.; Yonemura, A.; Muraki, K.; Okamoto, Y.; Tajiri, T.; Wang, Y. A.; Ishimoto, T."
2026-04-17,16,10.64898/2026.04.13.717731,1,neuroscience,Distinct Multimodal Imaging Correlates of Depression in Middle-Aged Adults With and Without a Family History of Alzheimer Disease,"Duarte Abritta, B.; Abulafia, C.; Fiorentini, L.; Tafet, G.; Brusco, L. I.; Tsuchiyagaito, A.; Mathew, S. J.; Villarreal, M. F.; Guinjoan, S. M."
2026-04-17,16,10.64898/2026.04.13.717714,1,immunology,Latent Effector Capacity Governs Reversible T Cell Exhaustion: A Mathematical Model for Mechanistically Predictive AI in PD-1 Blockade,"Liew, A. Y.; Li, Y.; Dong, H."
2026-04-17,16,10.64898/2026.04.14.718168,1,bioinformatics,Uncertainty-aware benchmarking reveals ambiguous transcripts in mRNA-lncRNA classification,"Garcia-Ruano, D.; Georges, M.; Mohanty, S. K.; Baaziz, R.; Makova, K. D.; Nikolski, M.; Chalopin, D."
2026-04-17,16,10.64898/2026.04.14.718511,1,bioinformatics,FairTCR: Equity-Aware TCR--pMHC Binding Prediction\\Across HLA Alleles and Cohort Strata,"Nowak, P.; Kowalski, J.; Lewandowski, T."
2026-04-17,16,10.64898/2026.04.14.718510,1,bioinformatics,Active Learning for Budget-Constrained TCR--pMHC Wet-Lab Validation,"Mazur, K.; Piotrowska, M.; Kowalski, J."
2026-04-17,16,10.64898/2026.04.14.717973,1,biophysics,Dynamic-Structure Redesign of Calmodulin Reveals Mechanistic Constraints on Ryr2 Regulation,"Bogdanov, V.; Tikunova, S.; Fadell, N.; Rebbeck, R. T.; Aprahamian, M. L.; Afsar, M. N. A.; Chekodanov, A.; Blackwell, D. J.; Knollmann, B. C.; Cornea, R. L.; Kekenes-Huskey, P. M.; Lindert, S.; Johnson, C. N.; Gyorke, S.; Davis, J. P."
2026-04-17,16,10.64898/2026.04.14.718262,1,cancer biology,Disruption of PI3K/OxPhos Coupling by Trehalose Drives a BCAA to Lipid Metabolic Switch in Hormone Receptor Positive Breast Cancer,"Singh, T.; Kaur, P.; Munshi, A.; Singh, S."
2026-04-17,16,10.64898/2026.04.13.717821,1,genomics,Detection of a sequence feature for recursive splicing,"Wang, B.; Yang, K.; Barash, Y.; Choi, P.; Mount, S. M.; Larson, D. R."
