Date,ISOWeek,DOI,Version,Category,Title,Authors
2026-04-15,16,10.64898/2026.04.13.717576,1,bioengineering,Changing the Fate of Dystrophin-Deficient Myoblasts via Hetero ligand Nanoclusters on Biomaterial Surface: Effects of Integrin-Syndecan or Dystroglycan Crosstalk,"Nour, S.; Swiderski, K.; Chee, A.; Murphy, K. T.; Watt, K. I.; Gregorevic, P.; Reevez, C. L.; Gelmi, A.; Lynch, G. S.; O'Connor, A. J.; Qiao, G. G.; Heath, D. E."
2026-04-15,16,10.64898/2026.04.12.717947,1,bioengineering,Rapid estimation of photon measurement density functions using a deep convolutional neural network for functional near-infrared spectroscopy,"Zhao, Y.; Sun, X.-T.; Shi, W.-D.; Zhu, C.-Z.; Zhang, L."
2026-04-15,16,10.64898/2026.04.13.718054,1,bioengineering,CHARIOT-AAV: Conjugation of diverse vectors to adeno-associated viruses for delivery of large genes,"Nagao, K.; Osaki, T.; Toyonaga, S.; Lee, C. G.; Vargas Paniagua, E.; Crespin Guerra, E.; Machen, S.; Beckham, J. L.; Sur, M.; Anderson, D. G.; Macfarlane, R. J.; Anikeeva, P."
2026-04-15,16,10.64898/2026.04.12.717982,1,bioinformatics,U-Probe: universal agentic probe design for imaging-based spatial-omics,"Zhang, Q.; Cai, H.; Zhang, J.; Zhang, L.; Wu, X.; Wei, Y.; Chen, Y.; Wu, X.; Su, W.; Qi, W.; Qiu, X.; Cao, G.; Xu, W."
2026-04-15,16,10.64898/2026.04.13.718197,1,bioinformatics,Differential co-localisation analysis of multi-sample and multi-condition experiments with spatialFDA,"Emons, M.; Scheipl, F.; Gunz, S.; Purdom, E.; Robinson, M. D."
2026-04-15,16,10.64898/2026.04.13.718149,1,bioinformatics,"π-MSNet: A billion-scale, AI-ready living proteomics data portal","Dai, C.; Liu, Y.; Ling, T.; Qiu, Y.; Xu, H.; Zhang, Q.; Huang, X.; Zhu, Y.; Sachsenberg, T.; Bai, M.; He, F.; Perez-Riverol, Y.; Xie, L.; Chang, C."
2026-04-15,16,10.64898/2026.04.13.718094,1,bioinformatics,Beyond Structure and Affinity: Context-Dependent Signals for de novo Binder Success,"Bozkurt, C."
2026-04-15,16,10.64898/2026.04.13.716081,1,bioinformatics,Benchmarking precision matrix estimation methods for differential co-expression network analysis,"Overmann, M.; Grabert, G.; Kacprowski, T."
2026-04-15,16,10.64898/2026.04.13.717533,1,bioinformatics,Sex-biased gene expression shapes sex differences in gene essentiality,"Rocca, C.; DeCasien, A. R."
2026-04-15,16,10.64898/2026.04.12.718068,1,biophysics,"Multifractal Fluctuations in Electrogram Dynamics Distinguish Atrial Fibrillation Phenotype, Drug Response, and Imminent Termination: Implications for Mechanism and Treatment.","Chapman, D. G.; Ganesan, A. N.; Strong, C.; Tonchev, I.; Lorensini, S.; Shahrbabaki, S. S."
2026-04-15,16,10.64898/2026.04.13.717683,1,biophysics,Single-molecule imaging and tracking on clinical liquid biopsies reveals cancer biomarkers nanoscale organization and heterogeneity,"Tholen, M. M. E.; Riera Brillas, R.; Hijzelaar, T. H. W.; Cao, H.; Cortopassi, F.; Moers, M. E.; Veta, M.; Cruijsen, M. J.; van de Kerkhof, D.; Scharnhorst, V.; Albertazzi, L."
2026-04-15,16,10.64898/2026.04.14.717675,1,biophysics,On-lamella super-resolution cryo-CLEM for cryo-ET enabled by vacuum-free ultra-stable cryogenic fluorescence microscopy,"Falckenhayn, J.; Duong, V. Q.; Prabhakar, N.; Harley, I.; Yuen, E. L. H.; Bozkurt, T. O.; Carter, S. D.; Prazak, V.; Kaufmann, R."
2026-04-15,16,10.64898/2026.04.12.718050,1,cancer biology,Benchmarking scRNA-seq Copy Number Inference: A Comprehensive Evaluation and Practitioner Guide,"Chang, H.-C.; Shi, Y.; Cheng, H.; Zou, J.; Chang, A. C.-C.; Schlegel, B. T.; Wang, W.; Brown, D. D.; Chen, F.; Wang, S.; Li, D.; Sai, R.; Michel, N.; Oesterreich, S.; Lee, A. V.; Tseng, G. C."
2026-04-15,16,10.64898/2026.04.13.718176,1,cancer biology,DLG2-DLG4 expression in lower-grade glioma is associated with improved survival and an excitatory synaptic transmission and plasticity gene signature,"Gaia, F.; Dal-Pizzol, H. R.; Malafaia, O.; Roesler, R.; Isolan, G. R."
2026-04-15,16,10.64898/2026.04.14.717586,1,cancer biology,Enzyme activity as an actionable axis for small-molecule precision oncology,"Fujita, K.; Kamiya, M.; Dan, S.; Tachibana, R.; Kawatani, M.; Kojima, R.; Hino, R.; Kobayashi, K.; Inoue, S.; Tani, M.; Hirata, Y.; Kawashima, S.; Yamazaki, K.; Nishimura, Y.; Ohashi, Y.; Isoyama, S.; Nakada, A.; Matsumoto, N.; Ikegaya, Y.; Nakajima, J.; Urano, Y."
2026-04-15,16,10.64898/2026.04.13.717530,1,cancer biology,Mutant KRAS promotes NF-kB driven CCL20 chemokine expression in pancreatic ductal adenocarcinoma,"Drouillard, D.; Davies, M.; McAllister, D.; Dwinell, M. B."
2026-04-15,16,10.64898/2026.04.12.718039,1,cancer biology,Specific Aneuploidies Predict Immune Evasion and Poor Immunotherapy Response in Melanoma,"Davoli, T.; Katsnelson, L.; Chen, S.; Rangel-Valenzuela, M.; Zhao, A.; Xiu, J.; Fenyo, D.; Bianchi, J."
2026-04-15,16,10.64898/2026.04.13.718130,1,physiology,Mineralization kinetics during embryonic avian bone growth: a three-dimensional multiscale and cryogenic imaging approach,"Seewald, A.; Zhong, J.; Sutaria, V.; El Charkawi, I.; Valleriani, A.; Fratzl, P.; Raguin, E."
2026-04-15,16,10.64898/2026.04.13.718132,1,plant biology,Plant LETM1 homologs are required for fungus-induced antibiotic resistance and biostimulation,"Dotson, B. R.; Panthapulakkal Narayanan, S.; Behnamian, S.; Kailasam, S.; Shah, M.; Kraft, T.; Schmidt, J.; Ekblad, T.; Veeckman, E.; Fredlund, K.; Grenville-Briggs, L. J.; Rasmusson, A. G."
2026-04-15,16,10.64898/2026.04.12.718001,1,systems biology,iCNG99: a validated genome-scale metabolic model of Cryptococcus neoformans strain H99,"Feng, C.; Hu, P.; Zhu, Y.; Ke, W.; Gao, X.; Ding, C.; Zhai, B.; Wang, L.; Dai, Z."
2026-04-15,16,10.64898/2026.04.13.718184,1,systems biology,Targeting HIV at its core: A mathematical model for optimizing Tat Inhibitor-based therapies toward enhanced functional cure strategies,"Waema, R.; Adongo, C.; Lago, S.; Ogutu, K."
2026-04-15,16,10.64898/2026.04.12.718060,1,neuroscience,Long-Stokes-Shift mScarlet3 as a Structural Marker for Two-Photon Imaging,"Xu, S.; Zhang, X.; Cheung, K. Y.; Mai, Y.; Wu, Y.; Claridge-Chang, A."
2026-04-15,16,10.64898/2026.04.13.718146,1,neuroscience,Bidirectional restoration of sleep homeostasis in neurodegeneration via closed-loop auditory stimulation,"Dias, I.; Zust, M.; Baumann, C. R.; Noain, D."
2026-04-15,16,10.64898/2026.04.13.718178,1,neuroscience,Reversing Pathophysiology in Fragile X Syndrome Mice by Promoting PGC-1α and Mitochondrial Functions,"Acharya, A.; Kumar, V.; Lee, K. Y.; Babik, M. S.; Goswami, G.; Boateng, K. A.; Cyphersmith, A. J.; Rhodes, J. S.; Tsai, N.-P."
2026-04-15,16,10.64898/2026.04.14.717814,1,neuroscience,A Community Standard Multispecies Cell Atlas of the Basal Ganglia,"Ecker, J. R.; Hawrylycz, M.; Lein, E.; Ren, B.; Thompson, C.; Zeng, H.; White, O.; Zhang, G.-Q."
2026-04-15,16,10.64898/2026.04.13.718117,1,immunology,Adaptive immunity is dispensable for salamander appendage regeneration,"Harrison Umeano, C.; Oesterle, M.; Ghaffarinia, A.; Okeke, U.; Larsson, N.; Meena, S.; Bolech, E.; Consiglio, C. R.; Eroglu, E.; Simon, A.; Leigh, N. D."
2026-04-15,16,10.64898/2026.04.13.718128,1,immunology,Adaptive immunity is dispensable for appendage regeneration in highly regenerative vertebrates,"Bolanos Castro, L. A.; Valappil, Y. O.; Petzold, A.; Knopf, F.; Yun, M. H."
2026-04-15,16,10.64898/2026.04.12.718055,1,immunology,PD-1 blockade enhances T cell activation by reorchestrating CD28 and CTLA4 ligand interactions,"Eun, G. S.; Boyd, J.; Au, V.; Garcia, A.; Cemerski, S.; Dovedi, S.; Pollizzi, K. N.; Dustin, M.; Varma, R."
2026-04-15,16,10.64898/2026.04.13.718173,1,molecular biology,Rpd3L Coordinates Chromatin State and Transcription-Replication Conflict Resolution through H3K4 Methylation-Dependent and Independent Mechanisms,"Chong, S. Y.; Chen, Y.-L.; Hsu, Y.-T.; Hsu, C.-L.; Lu, T.-M.; Lo, Y.-C.; Kao, C.-F."
2026-04-15,16,10.64898/2026.04.13.718151,1,cell biology,Derivation and characterization of an embryonic-derived muscle progenitor cell line from Atlantic salmon (Salmo salar),"Naylor, K.; Webb, S.; Rajesh, D.; Mee, P. J."
2026-04-15,16,10.64898/2026.04.13.718143,1,ecology,Estimating habitat-constrained home range size in semi-aquatic mammals: a case study on the critically endangered European mink (Mustela lutreola).,"Bodinier, R.; Aulagnier, S.; Bressan, Y.; Beaubert, R.; Fournier-Chambrillon, C.; Devillard, S.; Fournier, P."
2026-04-15,16,10.64898/2026.04.13.718119,1,ecology,How will climate change affect global amphipod species distributions by the end of the century?,"Momtazi, F.; Saeedi, H."
2026-04-15,16,10.64898/2026.04.13.718102,1,evolutionary biology,Bacterial strain structure shapes the trajectory of antibiotic resistance genes from plasmid to chromosome,"Guillemet, M.; Lehtinen, S."
2026-04-15,16,10.64898/2026.04.12.718059,1,evolutionary biology,Social caste switching triggers emergence of novel cellular identities in Zootermopsis termites,"Gatt, C. R.; Kikuchi, K.; Liu, C.; Kaymak, E.; Hellemans, S.; Koja, F.; Bourguignon, T.; Zanini, F."
2026-04-15,16,10.64898/2026.04.13.718121,1,biochemistry,A miniaturized MR1 metabolite display system with native-like protein features,"Rotsides, P.; Shinde, O.; Danon, J. N.; Sgourakis, N."
2026-04-15,16,10.64898/2026.04.13.718024,1,biochemistry,ChemCell: Chemical Tethering of Large Biomolecules to Cell Surfaces through Diels-Alder Ligation,"Dzijak, R.; Bellova, S.; Kovalova, A.; Slachtova, V.; Rahm, M.; Berankova, A.; Pohl, R.; Vrabel, M."
2026-04-15,16,10.64898/2026.04.14.718388,1,cancer biology,Loss of Mast cells and histaminergic signaling link diet to platelet-mediated NETosis and mammary cancer recurrence,"Schane, C. P.; Nelczyk, A. T.; Chen, C.; Seo, J.; Wang, Y.; Krawczynska, N. J.; Bendre, S. V.; Weisser, E.; Pradeep, D.; Vidana Gamage, H. E.; Kockaya, L.; Fei, Y.; Das Gupta, A.; Kim, H.; Henn Bungert, M.; Tejeda, R. I.; Wang, M.; Zhao, J.; Chittiboyina, A. G.; Khan, I. A.; Drnevich, J.; Kadiri, M.; McHenry, M. T.; Chen, J. J.; Ma, L.; He, S.; Hsiao, S.-H.; Fan, T. M.; Wendt, M.; Madak-Erdogan, Z.; Engeseth, N.; Helferich, W. G.; Nelson, E. R."
2026-04-15,16,10.64898/2026.04.13.718188,1,pathology,Heterogeneous transmission estimation and strategy optimization for Chikungunya: a vector-borne modeling study differentiating age and sex,"Li, J.; Zhao, Z.; Rui, J.; Zhao, J.; Luo, Q.; Li, K.; Song, W.; Perez, S.; Frutos, R.; Su, Y.; Chen, Q.; Xiang, T.; Chen, T."
2026-04-15,16,10.64898/2026.04.13.718123,1,systems biology,Gene Expression Variability with Feedback Regulation Implemented via Protein-Dependent Cell Growth,"Zabaikina, I.; Bokes, P.; Singh, A."
2026-04-15,16,10.64898/2026.04.12.718071,1,neuroscience,A Brain-wide Neuronal Spiking and Behavior Dataset for Working Memory-Specific Activation and Reactivation in Mice,"Huang, E.; Xu, D.; Zhu, H.; Chen, Z.; Li, P.; Chen, Y.; Lei, S.; Liu, J.; Li, C.; Zhang, X."
2026-04-15,16,10.64898/2026.04.13.718112,1,ecology,Mitigating consecutive drought impacts on forest productivity through strategic tree species spatial design,"Yu, W.; Brose, U.; Gauzens, B."
2026-04-15,16,10.64898/2026.04.13.718160,1,genomics,Spatial transcriptomic landscape of the Ciona adult brain: functional zonalisation and cellular composition in a sessile chordate brain and a novel insight into neural gland function,"Zeng, X.; Gyoja, F.; Maruo, A.; Okawa, N.; Mizutani, K.-i.; Suzuki, Y.; Nakai, K.; Kusakabe, T. G."
2026-04-15,16,10.64898/2026.04.13.718006,1,animal behavior and cognition,Lipopolysaccharide-induced systemic inflammation alters courtship ultrasonic vocalizations in male mice.,"Yamamoto, M.; Kasahara, H.; Hayashi, K.; Tamai, Y.; Toda, K."
2026-04-15,16,10.64898/2026.04.13.718147,1,bioinformatics,Decoding Single-Cell Omics of Perturbation Responses Using DeSCOPE,"Wu, P.; Wei, H.; Li, Y.; Zheng, X.; Zhou, C.; Hu, X.; Wang, C."
2026-04-15,16,10.64898/2026.04.12.718046,1,neuroscience,Does flavor-nutrient learning promote or protect against diet-induced obesity? Individual differences in conditionability predict resistance to weight gain in rats.,"Myers, K. P."
2026-04-15,16,10.64898/2026.04.13.718158,1,molecular biology,Identification of cellular double-stranded RNAs in mammalian embryonic stem cells,"Kases, K. J.; Marchante, P. G.; Witteveldt, J.; Peris, G.; Heras, S. R.; Macias, S."
2026-04-16,16,10.1101/2022.04.22.489200,2,biophysics,Mapping Strigolactone Hydrolysis in DWARF14 via QM/MM String Method,"Dean, T. J.; Chen, J.; Shukla, D."
2026-04-17,16,10.1101/2023.02.15.528638,4,bioinformatics,NetSyn: prokaryotic genomic context exploration of protein families,"Stam, M.; Langlois, j.; Chevalier, C.; Mainguy, J.; Reboul, G.; Bastard, K.; Medigue, C.; Vallenet, D."
2026-04-17,16,10.1101/2023.05.16.541036,2,genetics,GPC: An expressive and tractable deep generative model for genetic variation data,"Anand, P.; Liu, A.; Dang, M.; Fu, B.; Wei, X.; Van den Broeck, G.; Sankararaman, S."
2026-04-17,16,10.1101/2023.06.07.544112,2,neuroscience,Dopamine synchronizes hippocampal-prefrontal networks,"de Oliveira-Junior, B. A.; Padovan-Neto, F. E.; Narayanan, N. S.; Leite, J. P.; Ruggiero, R. N."
2026-04-16,16,10.1101/2023.07.10.548343,6,evolutionary biology,Population structure can reduce clonal interference when sexual reproduction and dispersal are synchronized,"Liu, Q.; Weissman, D. B."
2026-04-16,16,10.1101/2023.11.09.566298,5,scientific communication and education,Comparing the outputs of intramural and extramural grants funded by National Institutes of Health,"Zheng, X.; Yang, Q.; Potnuri, J.; Ni, C.; Hutchins, B. I."
2026-04-17,16,10.1101/2023.11.23.568428,5,bioinformatics,Interpretable models for scRNA-seq data embedding with multi-scale structure preservation,"Novak, D.; de Bodt, C.; Lambert, P.; Lee, J. A.; Van Gassen, S.; Saeys, Y."
2026-04-17,16,10.1101/2024.02.15.580451,7,neuroscience,Coding in cortical subpopulations critically depends on fine-tuning of cell physiology,"Revah, O.; Wolf, F.; Gutnick, M. J.; Neef, A."
2026-04-17,16,10.1101/2024.02.15.580495,5,cancer biology,Idiosyncratic and generic single nuclei and spatial transcriptional patterns in papillary and anaplastic thyroid cancers,"Tourneur, A.; Rodrigues Vitoria, J.; Saiselet, M.; Craciun, L.; Larsimont, D.; Lefort, A.; Libert, F.; Maenhaut, C.; Costagliola, S.; Tarabichi, M.; Romitti, M.; Detours, V."
2026-04-16,16,10.1101/2024.03.13.582463,2,plant biology,Combined sulfur deficiency and water deficit trigger synergistic redox adjustments through coordinated transcript-protein regulation in pea,"Bonnot, T.; Henriet, C.; Aime, D.; Kreplak, J.; Terezol, M.; Balliau, T.; Blanchard, C.; Lamotte, O.; Ourry, A.; Zivy, M.; Vernoud, V.; Gallardo, K."
2026-04-17,16,10.1101/2024.03.27.586699,3,neuroscience,Astrocytes mediate the dopaminergic modulation of tonic GABAergic signaling in substantia nigra,"Simmons, D. V.; Moreno-Ramos, O. A.; Raj, D. D. A.; Kaganovsky, K.; Pamukcu, A.; Vrieler, N.; Tkatch, T.; Xie, Z.; Zampese, E.; De Sousa, A. I. S.; Ding, J.; Awatramani, R. V.; Wilson, C.; Surmeier, D. J."
2026-04-17,16,10.1101/2024.05.26.595818,2,evolutionary biology,A protein interactome for the last eukaryotic common ancestor illuminates the biochemical basis of modern genetic diseases,"Cox, R. M.; Papoulas, O.; Shril, S.; Lee, C.; Gardner, T.; Ansari, Z.; Battenhouse, A. M.; Lee, M.; Drew, K.; McWhite, C. D.; Yang, D.; Leggere, J. C.; Durand, D.; Hildebrandt, F.; Wallingford, J. B.; Marcotte, E. M."
2026-04-16,16,10.1101/2024.08.30.610566,2,synthetic biology,Pathogen-inducible expression of autoactive NLRs confers multi-pathogen resistance in tomato,"Wei, W.; Koehler, N.; Vega, B.; Kim, D.; Bendl, A.; Cho, M.-J.; Krasileva, K."
2026-04-17,16,10.1101/2024.09.30.615940,5,bioinformatics,A new iterative framework for simulation-based population genetic inference with improved coverage properties of confidence intervals,"Rousset, F.; Leblois, R.; Estoup, A.; Marin, J.-M."
2026-04-17,16,10.1101/2024.10.10.617517,4,biochemistry,Cardiolipin deficiency disrupts electron transport chain and drives steatohepatitis,"Brothwell, M. J.; Cao, G.; Maschek, J. A.; Poss, A. M.; Peterlin, A. D.; Wang, L.; Baker, T. B.; Shahtout, J. L.; Siripoksup, P.; Pearce, Q. J.; Johnson, J. M.; Finger, F. M.; Prola, A.; Pellizzari, S. A.; Hale, G. L.; Manuel, A. M.; Watanabe, S.; Miranda, E. R.; Affolter, K. E.; Tippetts, T. S.; Nikolova, L. S.; Choi, R. H.; Decker, S. T.; Patil, M.; Catrow, J. L.; Holland, W. L.; Nowinski, S. M.; Lark, D. S.; Fisher-Wellman, K. H.; Mimche, P. N.; Evason, K. J.; Cox, J. E.; Summers, S. A.; Gerhart-Hines, Z.; Funai, K."
2026-04-17,16,10.1101/2024.10.09.617032,3,physiology,Metabolism fine tuning and cardiokines secretion represent adaptative responses of the heart to High Fat and High Sugar Diets in flies,"Khamvongsa-Charbonnier, L.; Kremmer, L.; Torres, M.; Krifa, S.; Aubert, C.; Corbet, A.; Crespo, L.; Roder, L.; Perrin, L.; Arquier, N."
2026-04-16,16,10.1101/2024.11.11.622832,3,bioengineering,Non-destructive transcriptomics via vesicular export,"Armbrust, N.; Grosshauser, M.; Geilenkeuser, J.; Stroppel, L.; Jozinovic, M.; Levermann, H.; Panne, T.; Wissmann, J.; Goelitz, L.; Schmidt, S.; Orschmann, T.; Rusha, E.; Steinmassl, E.; Widenmeyer, F.; Warsing, N.; Sabry, M.; Sultanbai, A.; Santl, T.; Geerlof, A.; Berezin, O.; Bodea, S.-V.; Moretti, A.; Schneider, S.; Theis, F.; Gagneur, J.; Truong, D.-J. J.; Westmeyer, G. G."
2026-04-17,16,10.1101/2024.11.16.623977,2,neuroscience,Sensory History Shapes Contrastive Neural Geometry in LP/Pulvinar-Prefrontal Cortex Circuits,"Leow, Y. N.; Natesan, A.; Barlowe, A.; Ahrlund-Richter, S.; Luo, C. T.; Jazayeri, M.; Sur, M."
2026-04-16,16,10.1101/2024.11.21.624777,3,developmental biology,Rapgef1 paralog-mediated regulation of Wnt/β-catenin signaling orchestrates early embryo tissue patterning and morphogenesis,"Prasad, T.; Iyer, S.; D'Silva, S.; Mathew, R. J.; Sowpati, D. T.; Radha, V.; Kumar, M."
2026-04-17,16,10.1101/2024.12.13.627927,3,cancer biology,PARP inhibitor counteracts Temozolomide Resistance in Glioblastoma Multiforme,"Samarut, E.; Tabourel, G.; Briand, J.; Landais, Y.; Gratas, C.; Loussouarn, D.; Bougras-Cartron, G.; Cartron, P.-F.; Vallette, F.; Salaud, C.; Oliver, L.; Serandour, A. A."
2026-04-16,16,10.1101/2025.01.18.633708,2,neuroscience,Cholinergic recruitment of Chandelier cells during arousal,"Martinez-Marquez, E.; Reyes-Leon, S.; Garcia-San-Jose, F.; Lopez-Begines, S.; Nieto-Gonzalez, J. L.; Garcia-Junco-Clemente, P."
2026-04-17,16,10.1101/2025.02.07.637177,2,microbiology,Archaeal lineages related to eukaryotes encode functional diterpenoid cyclases,"McShea, H.; De Anda, V.; Brochs, J.; Welander, P. V.; Baker, B. J."
2026-04-17,16,10.1101/2025.02.08.637206,2,microbiology,Anaerobic Fluorescent Reporters Enable In Vivo Tracking of VRE Dynamics in Enterococcus faecium,"Treat, B. R.; Hobeika, J.; Tvarkunas, M.; Guy, C.; Billiot, C. E.; Duggar, M.; Fields, T.; Black, M.; Kohler, C. M.; Margolis, E. B."
2026-04-16,16,10.1101/2025.02.10.637366,2,neuroscience,3-D Reconstruction of Fingertip Deformation during Contact Initiation,"Doumont, D.; Kao, A. R.; Lambert, J.; Wielant, F.; Gerling, G. J.; Delhaye, B. P.; Lefevre, P."
2026-04-17,16,10.1101/2025.02.19.638995,2,genetics,Managing the genetic diversity of animal populations using cryobanks: optimizing the constitution of ex situ collection?,"Jacques, A.; Tixier-Boichard, M.; Restoux, G."
2026-04-16,16,10.1101/2025.03.03.641203,11,bioinformatics,Pathway redistribution reveals a shared signaling backbone and context-dependent regulatory modules in RNA-binding protein networks,"Osato, N.; Sato, K."
2026-04-17,16,10.1101/2025.03.25.645246,4,neuroscience,MLIB: an easy-to-use Matlab toolbox for the analysis of extracellular spike data,"Stuttgen, M. C."
2026-04-17,16,10.1101/2025.04.02.646407,2,neuroscience,"A battery of image classification challenges reveals shared and distinct object categorization behavior across monkeys, humans, and deep networks","Zhang, H.; Zheng, Z.; Hu, J.; Wang, Q.; Xu, M.; Zhou, Z.; Li, Z.; Okazawa, G."
2026-04-16,16,10.1101/2025.05.05.652300,4,cancer biology,Mitfa-Independent Melanocyte Progenitors are Highly Susceptible to GNAQ-induced Uveal Melanoma in Adult Zebrafish,"Yevdash, J. I.; Robinson, D.; Moore, R.; Li, Z.; Campbell-Hanson, K. R.; Gutelius, D.; Moore, S. P. G.; Friend, D.; O'Toole, I.; Montgomery, C.; Riordan, J.; Dupuy, A.; Cornell, R. A.; Binkley, E. M.; Lang, D.; Weigel, R. J.; Kenny, C."
2026-04-17,16,10.1101/2025.05.12.653512,3,ecology,Eukaryotic biodiversity and ecological networks from the surface to the mesopelagic in the Northwest Atlantic Slope Water,"Yang, N.; Allan, E. A.; Stover, S. E.; Grassian, B. D.; Sosik, H. M.; Llopiz, J. K.; Govindarajan, A. F."
2026-04-16,16,10.1101/2025.05.25.655994,2,molecular biology,A safer fluorescent in situ hybridization protocol for cryosections,"Chihara, A.; Mizuno, R.; Kagawa, N.; Takayama, A.; Okumura, A.; Suzuki, M.; Shibata, Y.; Mochii, M.; Ohuchi, H.; Sato, K.; Suzuki, K.-i. T."
2026-04-17,16,10.1101/2025.06.13.659478,2,systems biology,A landscape description of the dynamics of Turing patterns,"Shinde, S.; Raju, A."
2026-04-17,16,10.1101/2025.06.29.662181,2,neuroscience,Prior knowledge shapes neural routes to novel inference across events,"Liu, Z.; Bramao, I.; Johansson, M."
2026-04-17,16,10.1101/2025.06.30.662279,3,pathology,Phenology of Hyalomma marginatum: a longitudinal study in a site of southern France,"STACHURSKI, F.; DUHAYON, M.; Appelgren, A.; BALANCA, G.; Giupponi, C.; POLLET, T.; Vial, L."
2026-04-16,16,10.1101/2025.07.08.663527,2,plant biology,Image-based leaf SPAD value and chlorophyll measurement using a mobile phone: enabling accessible and sustainable crop management,"Anderson, J.; Boonyaves, K.; Okamoto, H.; Karaket, N.; Chuekong, W.; Garvie, M.; Chabang, N.; Osorio, D.; Supaibulwatana, K."
2026-04-17,16,10.1101/2025.07.20.665618,3,neuroscience,sBOSC: A method for source-level identification of neural oscillations in electromagnetic brain signals,"Stern, E.; Niso, G.; Capilla, A."
2026-04-17,16,10.1101/2025.07.28.667287,2,cell biology,Reconstitution of lamin assembly on nuclear pore complex-containing membranes,"Pedersen, R. T.; Zhuang, Y.; Reyes, A. V.; Xu, S.-L.; Shi, X.; Zheng, Y."
2026-04-17,16,10.1101/2025.07.27.666827,2,immunology,SMAD2: Regulatory junction of TGF-β and antigen signaling in mast cells,"Bronneberg, G.; Meurer, S. K.; Kauffmann, M.; Kuo, C.-C.; Liedtke, C.; Weiskirchen, R.; Huber, M."
2026-04-17,16,10.1101/2025.08.01.664786,2,plant biology,Cellulose Synthase Complexes and Remorins Mediate Stress Resilience Through Cell Wall-Plasma Membrane Attachments,"Rui, Y.; Zaoralova, M.; Dwyer, W. P.; Reyes, A. V.; Grismer, T. S.; Abel, N. B.; Jayachandran, D.; Chundawat, S. P. S.; Ott, T.; Kieber, J. J.; Dahlberg, P.; Xu, S.-L.; Dinneny, J. R."
2026-04-16,16,10.1101/2025.08.06.668902,2,cell biology,Enteropathogenic E. coli-mediated Fast and Coordinated Ca2+ responses regulate NF-κB activation,"TRAN VAN NHIEU, G.; GUO, F.; GUEVARA, R.; OUSSAEIDINE, L.; DUPONT, G.; COMBETTES, L."
2026-04-16,16,10.1101/2025.08.07.669140,2,plant biology,Strigolactone effects on Sorghum bicolor ecophysiology and symbioses,"McLaughlin, C. M.; Takou, M.; Masanga, J.; Lawrence-Paul, E. H.; Abraham, E. J.; Perryman, M.; Calabritto, A.; Cheema, A.; Xu, Y.; Nebie, B.; Runo, S.; Kellogg, J. J.; Croce, R.; Schachtman, D. P.; Gao, H.; Sawers, R. J. H.; Lasky, J. R."
2026-04-17,16,10.1101/2025.08.11.669785,2,bioengineering,A handheld microfluidic manifold for massively multiplexed nucleic acid detection,"Kramer, S.; Song, R.; Huang, Y.; Hong, S.; Motlani, I.; Stone, H. A.; Myhrvold, C."
2026-04-16,16,10.1101/2025.08.15.670582,2,physiology,The neuropeptide neuromedin U receptor nmur-1 buffers insulin receptor signaling in bacteria-dependent C. elegans survival,"Sifoglu, D.; Pereira, B.; DeGregory, C.; Shah, R.; Maier, W.; Guan, J.; Clark, I.; Patel, D.; Ch'ng, Q.; Alcedo, J."
2026-04-16,16,10.1101/2025.08.21.671516,3,neuroscience,Shared latent representations of speech production for cross-patient speech decoding,"Spalding, Z.; Duraivel, S.; Rahimpour, S.; Wang, C.; Barth, K.; Schmitz, C.; Lad, N.; Friedman, A.; Southwell, D. G.; Viventi, J.; Cogan, G."
2026-04-17,16,10.1101/2025.08.22.671807,2,microbiology,A transcription factor-sRNA-mediated double-negative feedback loop confers pathogen-specific control of quorum-sensing genes,"Mashruwala, A. A.; Decker, K.; Fei, C.; Valastyan, J. S.; Bassler, B. L."
2026-04-17,16,10.1101/2025.08.20.671289,3,bioinformatics,"METRIN-KG: A knowledge graph integrating plant metabolites, traits, and biotic interactions","Tandon, D.; Mendes de Farias, T.; Allard, P.-M.; Defossez, E."
2026-04-17,16,10.1101/2025.08.25.672135,2,cell biology,LRRK2 mutations block NCOA4 trafficking upon iron overload leading to ferroptotic death,"Goldman, A.; Nguyen, M.; Lanoix, J.; Li, C.; Fahmy, A.; Zhong Xu, Y.; Schurr, E.; Thibault, P.; Desjardins, M.; McBride, H."
2026-04-17,16,10.1101/2025.08.27.671140,2,cancer biology,Positive Selection Screen Identifies Natural Product β-Catenin Inactivators,"Boudreau, M. W.; Freire, V. F.; Corbett, S. C.; Martinez-Fructuoso, L.; Shenoy, S. R.; Yu, W.; Kumar, R.; Thornburg, C. C.; Akee, R. K.; Peyser, B. D.; Jiang, Q.; Splaine, J.; Pfaff, J. L.; Chandler, B. C.; Abeja, D. M.; Donovan, K. A.; Che, J.; Lampson, B. L.; Cooke, M.; Kazanietz, M. G.; Szajner, P.; Smith, J. A.; Koduri, V.; Grkovic, T.; OKeefe, B. R.; Kaelin, W. G."
2026-04-17,16,10.1101/2025.08.27.672541,2,neuroscience,Frequency-dependent modulation of foveal contrast sensitivity by fine-scale exogenously triggered attention,"Guzhang, Y.; Poletti, M.; Jaeger, F. T."
